### ISSUE TITLE
Monitor mode works in Nintendo Switch but not dump

### ISSUE THREAD

**Issue by lucasgsantos** [seemoo-lab/nexmon#693]
Hi, I know this device or OS is not supported but I wanted to shared my findings.
I have a Nintendo switch V1 with Kubuntu 5.1.2 L4T Ubuntu Noble 24.04, kernel version 4.9
The WiFi chip is BCM4356, so I was able to patch the firmware and driver with Nexmon and put the interface in monitor mode (at least these is what the output looks like), but can't use any tool like airodump-ng or tcpdump, it does not show any network.
I can still use WiFi normally, so the firmware didn't crash anything, but I don't know why dump tools doesn't work.
Do you guys have any plans to support Nintendo switch? It looks like it is halfway there anyway.

The follow commands works fine:

iw phy \`iw dev wlp1s0 info | gawk '/wiphy/ {printf "phy" $2}'\` interface add mon0 type monitor

Or even

ip link set wlp1s0 down

iw dev wlan0 set type monitor

ip link set wlp1s0 up

Even 

airmon-ng start wlp1s0

It says unknown error 524 but it does create the extra monitoring interface

But airodump-ng does not show any network

Here it goes some more output 
 

root@srvito-laptop:\~# ethtool -i wlp1s0 2>/dev/null || true readlink -f /sys/class/net/wlp1s0/device/driver 2>/dev/null || true dmesg | grep -Ei 'brcm|brcmf|firmware|nexmon|wlan|wifi' | tail -n 100

driver: brcmfmac

version: [7.35.101.5](http://7.35.101.5)

firmware-version: 01-1d899931

expansion-rom-version:

bus-info: 0000:01:00.0

supports-statistics: no

supports-test: no

supports-eeprom-access: no

supports-register-dump: no

supports-priv-flags: no

root@srvito-laptop:\~# iw phy

Wiphy phy2

wiphy index: 2

max # scan SSIDs: 10

max scan IEs length: 2048 bytes

max # sched scan SSIDs: 16

max # match sets: 16

max # scan plans: 1

max scan plan interval: -1

max scan plan iterations: 0

Retry short limit: 7

Retry long limit: 4

Coverage class: 0 (up to 0m)

Device supports T-DLS.

Supported Ciphers:

\* WEP40 (00-0f-ac:1)

\* WEP104 (00-0f-ac:5)

\* TKIP (00-0f-ac:2)

\* CCMP-128 (00-0f-ac:4)

\* CMAC (00-0f-ac:6)

Available Antennas: TX 0 RX 0

Supported interface modes:

\* IBSS

\* managed

\* AP

\* monitor

\* P2P-client

\* P2P-GO

\* P2P-device

Band 1:

Capabilities: 0x1022

HT20/HT40

Static SM Power Save

RX HT20 SGI

No RX STBC

Max AMSDU length: 3839 bytes

DSSS/CCK HT40

Maximum RX AMPDU length 65535 bytes (exponent: 0x003)

Minimum RX AMPDU time spacing: 16 usec (0x07)

HT TX/RX MCS rate indexes supported: 0-15

Bitrates (non-HT):

\* 1.0 Mbps

\* 2.0 Mbps (short preamble supported)

\* 5.5 Mbps (short preamble supported)

\* 11.0 Mbps (short preamble supported)

\* 6.0 Mbps

\* 9.0 Mbps

\* 12.0 Mbps

\* 18.0 Mbps

\* 24.0 Mbps

\* 36.0 Mbps

\* 48.0 Mbps

\* 54.0 Mbps

Frequencies:

\* 2412 MHz \[1\] (20.0 dBm)

\* 2417 MHz \[2\] (20.0 dBm)

\* 2422 MHz \[3\] (20.0 dBm)

\* 2427 MHz \[4\] (20.0 dBm)

\* 2432 MHz \[5\] (20.0 dBm)

\* 2437 MHz \[6\] (20.0 dBm)

\* 2442 MHz \[7\] (20.0 dBm)

\* 2447 MHz \[8\] (20.0 dBm)

\* 2452 MHz \[9\] (20.0 dBm)

\* 2457 MHz \[10\] (20.0 dBm)

\* 2462 MHz \[11\] (20.0 dBm)

\* 2467 MHz \[12\] (disabled)

\* 2472 MHz \[13\] (disabled)

\* 2484 MHz \[14\] (disabled)

Band 2:

Capabilities: 0x1062

HT20/HT40

Static SM Power Save

RX HT20 SGI

RX HT40 SGI

No RX STBC

Max AMSDU length: 3839 bytes

DSSS/CCK HT40

Maximum RX AMPDU length 65535 bytes (exponent: 0x003)

Minimum RX AMPDU time spacing: 16 usec (0x07)

HT TX/RX MCS rate indexes supported: 0-15

VHT Capabilities (0x0c015820):

Max MPDU length: 3895

Supported Channel Width: neither 160 nor 80+80

short GI (80 MHz)

SU Beamformer

SU Beamformee

VHT RX MCS set:

1 streams: MCS 0-9

2 streams: MCS 0-9

3 streams: not supported

4 streams: not supported

5 streams: not supported

6 streams: not supported

7 streams: not supported

8 streams: not supported

VHT RX highest supported: 0 Mbps

VHT TX MCS set:

1 streams: MCS 0-9

2 streams: MCS 0-9

3 streams: not supported

4 streams: not supported

5 streams: not supported

6 streams: not supported

7 streams: not supported

8 streams: not supported

VHT TX highest supported: 0 Mbps

VHT extended NSS: not supported

Bitrates (non-HT):

\* 6.0 Mbps

\* 9.0 Mbps

\* 12.0 Mbps

\* 18.0 Mbps

\* 24.0 Mbps

\* 36.0 Mbps

\* 48.0 Mbps

\* 54.0 Mbps

Frequencies:

\* 5170 MHz \[34\] (20.0 dBm)

\* 5180 MHz \[36\] (20.0 dBm)

\* 5190 MHz \[38\] (20.0 dBm)

\* 5200 MHz \[40\] (20.0 dBm)

\* 5210 MHz \[42\] (20.0 dBm)

\* 5220 MHz \[44\] (20.0 dBm)

\* 5230 MHz \[46\] (20.0 dBm)

\* 5240 MHz \[48\] (20.0 dBm)

\* 5260 MHz \[52\] (20.0 dBm) (radar detection)

\* 5280 MHz \[56\] (20.0 dBm) (radar detection)

\* 5300 MHz \[60\] (20.0 dBm) (radar detection)

\* 5320 MHz \[64\] (20.0 dBm) (radar detection)

\* 5500 MHz \[100\] (20.0 dBm) (radar detection)

\* 5520 MHz \[104\] (20.0 dBm) (radar detection)

\* 5540 MHz \[108\] (20.0 dBm) (radar detection)

\* 5560 MHz \[112\] (20.0 dBm) (radar detection)

\* 5580 MHz \[116\] (20.0 dBm) (radar detection)

\* 5600 MHz \[120\] (20.0 dBm) (radar detection)

\* 5620 MHz \[124\] (20.0 dBm) (radar detection)

\* 5640 MHz \[128\] (20.0 dBm) (radar detection)

\* 5660 MHz \[132\] (20.0 dBm) (radar detection)

\* 5680 MHz \[136\] (20.0 dBm) (radar detection)

\* 5700 MHz \[140\] (20.0 dBm) (radar detection)

\* 5720 MHz \[144\] (20.0 dBm) (radar detection)

\* 5745 MHz \[149\] (20.0 dBm)

\* 5765 MHz \[153\] (20.0 dBm)

\* 5785 MHz \[157\] (20.0 dBm)

\* 5805 MHz \[161\] (20.0 dBm)

\* 5825 MHz \[165\] (20.0 dBm)

Supported commands:

\* new\_interface

\* set\_interface

\* new\_key

\* start\_ap

\* join\_ibss

\* set\_pmksa

\* del\_pmksa

\* flush\_pmksa

\* remain\_on\_channel

\* frame

\* set\_channel

\* tdls\_oper

\* start\_sched\_scan

\* start\_p2p\_device

\* crit\_protocol\_start

\* crit\_protocol\_stop

\* connect

\* disconnect

Supported TX frame types:

\* managed: 0x00 0x10 0x20 0x30 0x40 0x50 0x60 0x70 0x80 0x90 0xa0 0xb0 0xc0 0xd0 0xe0 0xf0

\* monitor: 0x00 0x10 0x20 0x30 0x40 0x50 0x60 0x70 0x80 0x90 0xa0 0xb0 0xc0 0xd0 0xe0 0xf0

\* P2P-client: 0x00 0x10 0x20 0x30 0x40 0x50 0x60 0x70 0x80 0x90 0xa0 0xb0 0xc0 0xd0 0xe0 0xf0

\* P2P-GO: 0x00 0x10 0x20 0x30 0x40 0x50 0x60 0x70 0x80 0x90 0xa0 0xb0 0xc0 0xd0 0xe0 0xf0

\* P2P-device: 0x00 0x10 0x20 0x30 0x40 0x50 0x60 0x70 0x80 0x90 0xa0 0xb0 0xc0 0xd0 0xe0 0xf0

Supported RX frame types:

\* managed: 0x40 0xd0

\* monitor: 0x00 0x10 0x20 0x30 0x40 0x50 0x60 0x70 0x80 0x90 0xa0 0xb0 0xc0 0xd0 0xe0 0xf0

\* P2P-client: 0x40 0xd0

\* P2P-GO: 0x00 0x20 0x40 0xa0 0xb0 0xc0 0xd0

\* P2P-device: 0x40 0xd0

software interface modes (can always be added):

valid interface combinations:

\* #{ managed } <= 1, #{ monitor } <= 1, #{ P2P-device } <= 1, #{ P2P-client, P2P-GO } <= 1,

total <= 4, #channels <= 1

\* #{ managed } <= 1, #{ AP } <= 1, #{ monitor } <= 1, #{ P2P-client } <= 1, #{ P2P-device } <= 1,

total <= 5, #channels <= 1

Device supports scan flush.

Device supports randomizing MAC-addr in sched scans.

Supported extended features:

root@srvito-laptop:\~# systemctl stop NetworkManager 2>/dev/null || true systemctl stop wpa\_supplicant 2>/dev/null || true pkill wpa\_supplicant 2>/dev/null || true

root@srvito-laptop:\~# iw dev mon0 del 2>/dev/null || true

root@srvito-laptop:\~# PHY=$(iw dev wlp1s0 info | awk '/wiphy/ {print "phy"$2}') echo "$PHY"

root@srvito-laptop:\~# iwconfig

usb0      no wireless extensions.

l4tbr0    no wireless extensions.

wlp1s0    IEEE 802.11  ESSID:off/any

Mode:Managed  Access Point: Not-Associated

Retry short limit:7   RTS thr:off   Fragment thr:off

Encryption key:off

Power Management:on

bond0     no wireless extensions.

usb1      no wireless extensions.

dummy0    no wireless extensions.

sit0      no wireless extensions.

tunl0     no wireless extensions.

lo        no wireless extensions.

root@srvito-laptop:\~# iw phy "$PHY" interface add mon0 type monitor

command failed: No such file or directory (-2)

root@srvito-laptop:\~# iw dev wlp1s0 info

Interface wlp1s0

ifindex 11

wdev 0x200000001

addr 98:b6:e9:1c:c0:0a

type managed

wiphy 2

channel 1 (2412 MHz), width: 20 MHz, center1: 2412 MHz

root@srvito-laptop:\~# iw phy \`iw dev wlp1s0 info | gawk '/wiphy/ {printf "phy" $2}'\` interface add mon0 type monitor

root@srvito-laptop:\~# iwconfig

usb0      no wireless extensions.

l4tbr0    no wireless extensions.

mon0      IEEE 802.11  Mode:Monitor  Frequency:2.412 GHz

Retry short limit:7   RTS thr:off   Fragment thr:off

Power Management:on

wlp1s0    IEEE 802.11  ESSID:off/any

Mode:Managed  Access Point: Not-Associated

Retry short limit:7   RTS thr:off   Fragment thr:off

Encryption key:off

Power Management:on

bond0     no wireless extensions.

usb1      no wireless extensions.

dummy0    no wireless extensions.

sit0      no wireless extensions.

tunl0     no wireless extensions.

lo        no wireless extensions.

root@srvito-laptop:\~# ip link set mon0 up

root@srvito-laptop:\~# iw dev mon0 set channel 6

root@srvito-laptop:\~# iw dev mon0 info

Interface mon0

ifindex 12

wdev 0x200000003

addr 98:b6:e9:1c:c0:0a

type monitor

wiphy 2

channel 6 (2437 MHz), width: 20 MHz, center1: 2437 MHz

root@srvito-laptop:\~# tcpdump -i mon0 -l -e -s 0 -vv

tcpdump: listening on mon0, link-type IEEE802\_11\_RADIO (802.11 plus radiotap header), snapshot length 262144 bytes

root@srvito-laptop:/home/srvito# uname -a
Linux srvito-laptop 4.9.140-l4t #149 SMP PREEMPT Sat Aug 15 22:11:25 EDT 2026 aarch64 aarch64 aarch64 GNU/Linux
root@srvito-laptop:/home/srvito# iw dev
phy#0
        Unnamed/non-netdev interface
                wdev 0x2
                addr 9a:b6:e9:1c:c0:0a
                type P2P-device
                txpower 31.00 dBm
        Interface wlp1s0
                ifindex 6
                wdev 0x1
                addr 98:b6:e9:1c:c0:0a
                ssid NILDA-5G
                type managed
                channel 44 (5220 MHz), width: 80 MHz, center1: 5210 MHz
                txpower 31.00 dBm
root@srvito-laptop:/home/srvito# iw phy
Wiphy phy0
        wiphy index: 0
        max # scan SSIDs: 10
        max scan IEs length: 2048 bytes
        max # sched scan SSIDs: 16
        max # match sets: 16
        max # scan plans: 1
        max scan plan interval: -1
        max scan plan iterations: 0
        Retry short limit: 7
        Retry long limit: 4
        Coverage class: 0 (up to 0m)
        Device supports T-DLS.
        Supported Ciphers:
                * WEP40 (00-0f-ac:1)
                * WEP104 (00-0f-ac:5)
                * TKIP (00-0f-ac:2)
                * CCMP-128 (00-0f-ac:4)
                * CMAC (00-0f-ac:6)
        Available Antennas: TX 0 RX 0
        Supported interface modes:
                 * IBSS
                 * managed
                 * AP
                 * monitor
                 * P2P-client
                 * P2P-GO
                 * P2P-device
        Band 1:
                Capabilities: 0x1022
                        HT20/HT40
                        Static SM Power Save
                        RX HT20 SGI
                        No RX STBC
                        Max AMSDU length: 3839 bytes
                        DSSS/CCK HT40
                Maximum RX AMPDU length 65535 bytes (exponent: 0x003)
                Minimum RX AMPDU time spacing: 16 usec (0x07)
                HT TX/RX MCS rate indexes supported: 0-15
                Bitrates (non-HT):
                        * 1.0 Mbps
                        * 2.0 Mbps (short preamble supported)
                        * 5.5 Mbps (short preamble supported)
                        * 11.0 Mbps (short preamble supported)
                        * 6.0 Mbps
                        * 9.0 Mbps
                        * 12.0 Mbps
                        * 18.0 Mbps
                        * 24.0 Mbps
                        * 36.0 Mbps
                        * 48.0 Mbps
                        * 54.0 Mbps
                Frequencies:
                        * 2412 MHz [1] (20.0 dBm)
                        * 2417 MHz [2] (20.0 dBm)
                        * 2422 MHz [3] (20.0 dBm)
                        * 2427 MHz [4] (20.0 dBm)
                        * 2432 MHz [5] (20.0 dBm)
                        * 2437 MHz [6] (20.0 dBm)
                        * 2442 MHz [7] (20.0 dBm)
                        * 2447 MHz [8] (20.0 dBm)
                        * 2452 MHz [9] (20.0 dBm)
                        * 2457 MHz [10] (20.0 dBm)
                        * 2462 MHz [11] (20.0 dBm)
                        * 2467 MHz [12] (disabled)
                        * 2472 MHz [13] (disabled)
                        * 2484 MHz [14] (disabled)
        Band 2:
                Capabilities: 0x1062
                        HT20/HT40
                        Static SM Power Save
                        RX HT20 SGI
                        RX HT40 SGI
                        No RX STBC
                        Max AMSDU length: 3839 bytes
                        DSSS/CCK HT40
                Maximum RX AMPDU length 65535 bytes (exponent: 0x003)
                Minimum RX AMPDU time spacing: 16 usec (0x07)
                HT TX/RX MCS rate indexes supported: 0-15
                VHT Capabilities (0x0c015820):
                        Max MPDU length: 3895
                        Supported Channel Width: neither 160 nor 80+80
                        short GI (80 MHz)
                        SU Beamformer
                        SU Beamformee
                VHT RX MCS set:
                        1 streams: MCS 0-9
                        2 streams: MCS 0-9
                        3 streams: not supported
                        4 streams: not supported
                        5 streams: not supported
                        6 streams: not supported
                        7 streams: not supported
                        8 streams: not supported
                VHT RX highest supported: 0 Mbps
                VHT TX MCS set:
                        1 streams: MCS 0-9
                        2 streams: MCS 0-9
                        3 streams: not supported
                        4 streams: not supported
                        5 streams: not supported
                        6 streams: not supported
                        7 streams: not supported
                        8 streams: not supported
                VHT TX highest supported: 0 Mbps
                VHT extended NSS: not supported
                Bitrates (non-HT):
                        * 6.0 Mbps
                        * 9.0 Mbps
                        * 12.0 Mbps
                        * 18.0 Mbps
                        * 24.0 Mbps
                        * 36.0 Mbps
                        * 48.0 Mbps
                        * 54.0 Mbps
                Frequencies:
                        * 5170 MHz [34] (20.0 dBm)
                        * 5180 MHz [36] (20.0 dBm)
                        * 5190 MHz [38] (20.0 dBm)
                        * 5200 MHz [40] (20.0 dBm)
                        * 5210 MHz [42] (20.0 dBm)
                        * 5220 MHz [44] (20.0 dBm)
                        * 5230 MHz [46] (20.0 dBm)
                        * 5240 MHz [48] (20.0 dBm)
                        * 5260 MHz [52] (20.0 dBm) (radar detection)
                        * 5280 MHz [56] (20.0 dBm) (radar detection)
                        * 5300 MHz [60] (20.0 dBm) (radar detection)
                        * 5320 MHz [64] (20.0 dBm) (radar detection)
                        * 5500 MHz [100] (20.0 dBm) (radar detection)
                        * 5520 MHz [104] (20.0 dBm) (radar detection)
                        * 5540 MHz [108] (20.0 dBm) (radar detection)
                        * 5560 MHz [112] (20.0 dBm) (radar detection)
                        * 5580 MHz [116] (20.0 dBm) (radar detection)
                        * 5600 MHz [120] (20.0 dBm) (radar detection)
                        * 5620 MHz [124] (20.0 dBm) (radar detection)
                        * 5640 MHz [128] (20.0 dBm) (radar detection)
                        * 5660 MHz [132] (20.0 dBm) (radar detection)
                        * 5680 MHz [136] (20.0 dBm) (radar detection)
                        * 5700 MHz [140] (20.0 dBm) (radar detection)
                        * 5720 MHz [144] (20.0 dBm) (radar detection)
                        * 5745 MHz [149] (20.0 dBm)
                        * 5765 MHz [153] (20.0 dBm)
                        * 5785 MHz [157] (20.0 dBm)
                        * 5805 MHz [161] (20.0 dBm)
                        * 5825 MHz [165] (20.0 dBm)
        Supported commands:
                 * new_interface
                 * set_interface
                 * new_key
                 * start_ap
                 * join_ibss
                 * set_pmksa
                 * del_pmksa
                 * flush_pmksa
                 * remain_on_channel
                 * frame
                 * set_channel
                 * tdls_oper
                 * start_sched_scan
                 * start_p2p_device
                 * crit_protocol_start
                 * crit_protocol_stop
                 * connect
                 * disconnect
        Supported TX frame types:
                 * managed: 0x00 0x10 0x20 0x30 0x40 0x50 0x60 0x70 0x80 0x90 0xa0 0xb0 0xc0 0xd0 0xe0 0xf0
                 * monitor: 0x00 0x10 0x20 0x30 0x40 0x50 0x60 0x70 0x80 0x90 0xa0 0xb0 0xc0 0xd0 0xe0 0xf0
                 * P2P-client: 0x00 0x10 0x20 0x30 0x40 0x50 0x60 0x70 0x80 0x90 0xa0 0xb0 0xc0 0xd0 0xe0 0xf0
                 * P2P-GO: 0x00 0x10 0x20 0x30 0x40 0x50 0x60 0x70 0x80 0x90 0xa0 0xb0 0xc0 0xd0 0xe0 0xf0
                 * P2P-device: 0x00 0x10 0x20 0x30 0x40 0x50 0x60 0x70 0x80 0x90 0xa0 0xb0 0xc0 0xd0 0xe0 0xf0
        Supported RX frame types:
                 * managed: 0x40 0xd0
                 * monitor: 0x00 0x10 0x20 0x30 0x40 0x50 0x60 0x70 0x80 0x90 0xa0 0xb0 0xc0 0xd0 0xe0 0xf0
                 * P2P-client: 0x40 0xd0
                 * P2P-GO: 0x00 0x20 0x40 0xa0 0xb0 0xc0 0xd0
                 * P2P-device: 0x40 0xd0
        software interface modes (can always be added):
        valid interface combinations:
                 * #{ managed } <= 1, #{ monitor } <= 1, #{ P2P-device } <= 1, #{ P2P-client, P2P-GO } <= 1,
                   total <= 4, #channels <= 1
                 * #{ managed } <= 1, #{ AP } <= 1, #{ monitor } <= 1, #{ P2P-client } <= 1, #{ P2P-device } <= 1,
                   total <= 5, #channels <= 1
        Device supports scan flush.
        Device supports randomizing MAC-addr in sched scans.
        Supported extended features:
root@srvito-laptop:/home/srvito# ethtool -i wlp1s0
driver: brcmfmac
version: 7.35.101.5
firmware-version: 01-1d899931
expansion-rom-version: 
bus-info: 0000:01:00.0
supports-statistics: no
supports-test: no
supports-eeprom-access: no
supports-register-dump: no
supports-priv-flags: no
root@srvito-laptop:/home/srvito# sudo nexutil -Iwlp1s0 -m
monitor: 0
root@srvito-laptop:/home/srvito# dmesg | grep -Ei 'brcm|firmware|nexmon' | tail -n 100
[    0.000000] psci: PSCIv1.1 detected in firmware.
[    0.000000] Kernel command line: root=/dev/mmcblk0p2 rootfstype=ext4 rw   firmware_class.path=/lib/firmware/ access=m2   rootlabel=SWR-NOB rootlabel_retries=1   boot_m=1 boot_p=1 swr_dir=/switchroot/ubuntu-noble/   pmc_r2p.enabled=1 pmc_r2p.action=self   pmc_r2p.param1=2 pmc_r2p.param2=1   fbcon=map:9 consoleblank=0   nvdec_enabled=0 tegra_fbmem=0x400000@0xf5a00000 systemd.unified_cgroup_hierarchy=0 systemd.legacy_systemd_cgroup_controller=1 splash 
[    1.179324] tegra-xusb 70090000.xusb: Firmware timestamp: 2019-10-17 15:58:59 UTC, Version: 50.25 release
[   10.385783] brcmfmac: loading out-of-tree module taints kernel.
[   10.390648] brcmfmac 0000:01:00.0: enabling device (0000 -> 0002)
[   11.271917] brcmfmac: Firmware version = wl0: Feb  3 2017 18:37:23 version 7.35.101.5 (r682980) FWID 01-1d899931
[   11.272141] brcmfmac: brcmf_c_preinit_dcmds: CLM version = API: 12.1 Data: 7.10.16 Compiler: 1.21.1 ClmImport: 1.21.1 Creation: 2014-02-13 17:00:38 Inc Data: 9.2.6 Inc Compiler: 1.26.12 Inc ClmImport: 1.29.19 Creation: 2017-02-03 18:34:53 
[   11.275246] brcmfmac: brcmf_cfg80211_attach: brcmf_cfg80211_attach: enter
[   11.276093] brcmfmac: brcmf_setup_ifmodes: brcmf_setup_ifmodes: p2p=1, mbss=0
[   11.315031] brcmfmac 0000:01:00.0 wlp1s0: renamed from wlan0
[   15.033012] brcmfmac: brcmf_cfg80211_change_iface: brcmf_cfg80211_change_iface, iftype: 2
[   15.033196] brcmfmac: brcmf_cfg80211_update_proto_addr_mode: brcmf_cfg80211_update_proto_addr_mode: ADDR_INDIRECT
[   15.033914] brcmfmac: power management disabled
[   15.143846] brcmfmac: brcmf_cfg80211_add_iface: brcmf_cfg80211_add_iface enter: p2p-dev-wlp1s0 type 10
[   15.143873] brcmfmac: brcmf_vif_add_validate: brcmf_vif_add_validate, NUM_NL80211_IFTYPES: (13)
[   15.143889] brcmfmac: brcmf_vif_add_validate: brcmf_vif_add_validate, pos->wdev.iftype: (2)
[   15.143905] brcmfmac: brcmf_vif_add_validate: brcmf_vif_add_validate, cfg80211_check_combinations for iftype_num: (0)        val:(0)
[   15.143921] brcmfmac: brcmf_vif_add_validate: brcmf_vif_add_validate, cfg80211_check_combinations for iftype_num: (1)        val:(0).
[   29.574516] brcmfmac: brcmf_cfg80211_reg_notifier: not a ISO3166 code (0x55 0x53)
[  537.180654] brcmfmac: nexmon_nl_ioctl_handler: NEXMON: nexmon_nl_ioctl_handler: Enter
[  537.180672] brcmfmac: nexmon_nl_ioctl_handler: NEXMON: nexmon_nl_ioctl_handler: 0058454e 20 36
[  537.180681] brcmfmac: nexmon_nl_ioctl_handler: NEXMON: nexmon_nl_ioctl_handler: calling brcmf_fil_cmd_data_get, cmd: 107
[  537.180807] brcmfmac: nexmon_nl_ioctl_handler: NEXMON: nexmon_nl_ioctl_handler: Exit
root@srvito-laptop:/home/srvito# cat /sys/class/net/mon0/type
cat: /sys/class/net/mon0/type: No such file or directory
root@srvito-laptop:/home/srvito# cat /proc/net/dev | grep -E 'mon0|wlp1s0|wlan0'
wlp1s0: 4463457    5734    0    0    0     0          0       132  1736678    4339    0    0    0     0       0          0
root@srvito-laptop:/home/srvito#

**Comment by jlinktu** [comment]
From the output of `iw dev` that you posted I can see that you are connected to a network 'NILDA-5G', monitor mode won't work while being connected to a network. Try to disconnect first and additionally prevent any networking programs to take control over the wireless interfaces (e.g. tell Network Manager to to ignore your wireless interfaces or/and kill `wpa_supplicant` and prevent it from starting automatically).

**Comment by lucasgsantos** [comment]
> From the output of `iw dev` that you posted I can see that you are connected to a network 'NILDA-5G', monitor mode won't work while being connected to a network. Try to disconnect first and additionally prevent any networking programs to take control over the wireless interfaces (e.g. tell Network Manager to to ignore your wireless interfaces or/and kill `wpa_supplicant` and prevent it from starting automatically).

HI @jlinktu.
Sorry for the confusion, I restarted the system before executing "uname -a" just to get some more information, so everything from "uname -a" forward it was executed in a "clean" state

But as you can see, I did disconnected and kill everything before creating the interface in monitor mode with the command bellow:
systemctl stop NetworkManager 2>/dev/null || true systemctl stop wpa_supplicant 2>/dev/null || true pkill wpa_supplicant 2>/dev/null || true
I even tried airmon-ng check kill or uninstalling wpa_supplicant and the result was the same so I am pretty sure the problem is not other services interfering with the connection.
The funny thing is that there is never an error message anywhere, the driver always answers as everything went right and I can never find any error message in 
dmesg | grep -Ei 'brcm|firmware|nexmon|wlp1s0|mon0|ERR:'
Only tcpdump and airodump-ng does not show anything

**Comment by jlinktu** [comment]
Instead of creating a monitor interface you might want to try to just enable monitor mode within the firmware (`nexutil -Iwlp1s0 -m2`) and use [`libfakeioctl`](https://github.com/seemoo-lab/nexmon/tree/master/utilities/libfakeioctl) to make it appear as monitor interface to the tool that you want to use.

**Comment by lucasgsantos** [comment]
> nexutil -Iwlp1s0 -m2

It is not working, it does not enable monitor mode in the wlp1s0 interface and it also does not create a new one

root@srvito-laptop:/home/srvito# systemctl stop NetworkManager 2>/dev/null || true systemctl stop wpa_supplicant 2>/dev/null || true pkill wpa_supplicant 2>/dev/null || true
root@srvito-laptop:/home/srvito# iwconfig
usb0      no wireless extensions.

l4tbr0    no wireless extensions.

wlp1s0    IEEE 802.11  ESSID:off/any  
          Mode:Managed  Access Point: Not-Associated   
          Retry short limit:7   RTS thr:off   Fragment thr:off
          Encryption key:off
          Power Management:on
          
bond0     no wireless extensions.

usb1      no wireless extensions.

dummy0    no wireless extensions.

enxe466e56d0229  no wireless extensions.

sit0      no wireless extensions.

tunl0     no wireless extensions.

lo        no wireless extensions.

root@srvito-laptop:/home/srvito# nexutil -Iwlp1s0 -m2
root@srvito-laptop:/home/srvito# iwconfig
usb0      no wireless extensions.

l4tbr0    no wireless extensions.

wlp1s0    IEEE 802.11  ESSID:off/any  
          Mode:Managed  Access Point: Not-Associated   
          Retry short limit:7   RTS thr:off   Fragment thr:off
          Encryption key:off
          Power Management:on
          
bond0     no wireless extensions.

usb1      no wireless extensions.

dummy0    no wireless extensions.

enxe466e56d0229  no wireless extensions.

sit0      no wireless extensions.

tunl0     no wireless extensions.

lo        no wireless extensions.

root@srvito-laptop:/home/srvito# LD_PRELOAD=/usr/lib/libnexmonkali.so airodump-ng wlp1s0

ARP linktype is set to 1 (Ethernet) - expected ARPHRD_IEEE80211,
ARPHRD_IEEE80211_FULL or ARPHRD_IEEE80211_PRISM instead.  Make
sure RFMON is enabled: run 'airmon-ng start wlp1s0 <#>'
Sysfs injection support was not found either.

Failed initializing wireless card(s): wlp1s0
root@srvito-laptop:/home/srvito# dmesg | grep -Ei 'brcm|firmware|nexmon|wlp1s0|mon0|ERR:' | tail -n 200
[    0.000000] psci: PSCIv1.1 detected in firmware.
[    0.000000] Kernel command line: root=/dev/mmcblk0p2 rootfstype=ext4 rw   firmware_class.path=/lib/firmware/ access=m2   rootlabel=SWR-NOB rootlabel_retries=1   boot_m=1 boot_p=1 swr_dir=/switchroot/ubuntu-noble/   pmc_r2p.enabled=1 pmc_r2p.action=self   pmc_r2p.param1=1 pmc_r2p.param2=1   fbcon=map:9 consoleblank=0   nvdec_enabled=0 tegra_fbmem=0x400000@0xf5a00000 systemd.unified_cgroup_hierarchy=0 systemd.legacy_systemd_cgroup_controller=1 splash 
[    0.143266] mc-err: mcerr ops are set to t21x
[    1.172916] THERMAL TSKIN EST: end of probe, return err: 0
[    1.183324] tegra-xusb 70090000.xusb: Firmware timestamp: 2019-10-17 15:58:59 UTC, Version: 50.25 release
[    1.801078] tegra210-cpufreq cpufreq: probe()...err:-517
[   10.414582] brcmfmac: loading out-of-tree module taints kernel.
[   10.420115] brcmfmac 0000:01:00.0: enabling device (0000 -> 0002)
[   13.280543] brcmfmac: brcmf_msgbuf_query_dcmd: Timeout on response for query command
[   13.280570] brcmfmac: brcmf_c_get_clm_name: retrieving revision info failed (-5)
[   13.280587] brcmfmac: brcmf_c_process_clm_blob: get CLM blob file name failed (-5)
[   13.280603] brcmfmac: brcmf_c_preinit_dcmds: download CLM blob file failed, -5
[   13.280618] brcmfmac: brcmf_bus_start: failed: -5
[   13.280637] brcmfmac: brcmf_pcie_attach_bus: dongle is not responding
[   78.047696] tegra-xusb 70090000.xusb: Firmware timestamp: 2019-10-17 15:58:59 UTC, Version: 50.25 release
[   93.666364] tegra-xusb 70090000.xusb: Firmware timestamp: 2019-10-17 15:58:59 UTC, Version: 50.25 release
[   95.859036] tegra-xusb 70090000.xusb: Firmware timestamp: 2019-10-17 15:58:59 UTC, Version: 50.25 release
[   98.187784] tegra-xusb 70090000.xusb: Firmware timestamp: 2019-10-17 15:58:59 UTC, Version: 50.25 release
[  102.869448] tegra-xusb 70090000.xusb: Firmware timestamp: 2019-10-17 15:58:59 UTC, Version: 50.25 release
[  145.034327] tegra-xusb 70090000.xusb: Firmware timestamp: 2019-10-17 15:58:59 UTC, Version: 50.25 release
[  151.924440] tegra-xusb 70090000.xusb: Firmware timestamp: 2019-10-17 15:58:59 UTC, Version: 50.25 release
[  154.262483] tegra-xusb 70090000.xusb: Firmware timestamp: 2019-10-17 15:58:59 UTC, Version: 50.25 release
[  158.941891] tegra-xusb 70090000.xusb: Firmware timestamp: 2019-10-17 15:58:59 UTC, Version: 50.25 release
[  537.016737] brcmfmac: Firmware version = wl0: Feb  3 2017 18:37:23 version 7.35.101.5 (r682980) FWID 01-1d899931
[  537.016955] brcmfmac: brcmf_c_preinit_dcmds: CLM version = API: 12.1 Data: 7.10.16 Compiler: 1.21.1 ClmImport: 1.21.1 Creation: 2014-02-13 17:00:38 Inc Data: 9.2.6 Inc Compiler: 1.26.12 Inc ClmImport: 1.29.19 Creation: 2017-02-03 18:34:53 
[  537.019516] brcmfmac: brcmf_cfg80211_attach: brcmf_cfg80211_attach: enter
[  537.019667] brcmfmac: brcmf_setup_ifmodes: brcmf_setup_ifmodes: p2p=1, mbss=0
[  537.065183] brcmfmac 0000:01:00.0 wlp1s0: renamed from wlan0
[  537.096168] IPv6: ADDRCONF(NETDEV_UP): wlp1s0: link is not ready
[  537.133900] brcmfmac: brcmf_cfg80211_change_iface: brcmf_cfg80211_change_iface, iftype: 2
[  537.134060] brcmfmac: brcmf_cfg80211_update_proto_addr_mode: brcmf_cfg80211_update_proto_addr_mode: ADDR_INDIRECT
[  537.134754] brcmfmac: power management disabled
[  537.184799] brcmfmac: brcmf_cfg80211_add_iface: brcmf_cfg80211_add_iface enter: p2p-dev-wlp1s0 type 10
[  537.184813] brcmfmac: brcmf_vif_add_validate: brcmf_vif_add_validate, NUM_NL80211_IFTYPES: (13)
[  537.184821] brcmfmac: brcmf_vif_add_validate: brcmf_vif_add_validate, pos->wdev.iftype: (2)
[  537.184827] brcmfmac: brcmf_vif_add_validate: brcmf_vif_add_validate, cfg80211_check_combinations for iftype_num: (0)        val:(0)
[  537.184833] brcmfmac: brcmf_vif_add_validate: brcmf_vif_add_validate, cfg80211_check_combinations for iftype_num: (1)        val:(0)
[  537.248294] IPv6: ADDRCONF(NETDEV_UP): wlp1s0: link is not ready
[  542.581059] brcmfmac: brcmf_cfg80211_reg_notifier: not a ISO3166 code (0x42 0x52)
[  542.603207] IPv6: ADDRCONF(NETDEV_CHANGE): wlp1s0: link becomes ready
[  599.751888] brcmfmac: brcmf_p2p_send_action_frame: Unknown Frame: category 0xa, action 0x8
[  659.140485] brcmfmac: brcmf_p2p_send_action_frame: Unknown Frame: category 0xa, action 0x8
[  724.280434] brcmfmac: nexmon_nl_ioctl_handler: NEXMON: nexmon_nl_ioctl_handler: Enter
[  724.280447] brcmfmac: nexmon_nl_ioctl_handler: NEXMON: nexmon_nl_ioctl_handler: 0058454e 20 36
[  724.280455] brcmfmac: nexmon_nl_ioctl_handler: NEXMON: nexmon_nl_ioctl_handler: calling brcmf_fil_cmd_data_set, cmd: 108
[  724.315753] brcmfmac: nexmon_nl_ioctl_handler: NEXMON: nexmon_nl_ioctl_handler: Exit
[  752.661957] brcmfmac: nexmon_nl_ioctl_handler: NEXMON: nexmon_nl_ioctl_handler: Enter
[  752.661972] brcmfmac: nexmon_nl_ioctl_handler: NEXMON: nexmon_nl_ioctl_handler: 0058454e 20 36
[  752.661980] brcmfmac: nexmon_nl_ioctl_handler: NEXMON: nexmon_nl_ioctl_handler: calling brcmf_fil_cmd_data_set, cmd: 108
[  752.662167] brcmfmac: nexmon_nl_ioctl_handler: NEXMON: nexmon_nl_ioctl_handler: Exit
[  788.958207] brcmfmac: nexmon_nl_ioctl_handler: NEXMON: nexmon_nl_ioctl_handler: Enter
[  788.958233] brcmfmac: nexmon_nl_ioctl_handler: NEXMON: nexmon_nl_ioctl_handler: 0058454e 20 36
[  788.958241] brcmfmac: nexmon_nl_ioctl_handler: NEXMON: nexmon_nl_ioctl_handler: calling brcmf_fil_cmd_data_set, cmd: 108
[  788.959236] brcmfmac: nexmon_nl_ioctl_handler: NEXMON: nexmon_nl_ioctl_handler: Exit
[  825.520095] brcmfmac: brcmf_cfg80211_change_iface: brcmf_cfg80211_change_iface, iftype: 6
[  825.520210] brcmfmac: brcmf_cfg80211_update_proto_addr_mode: brcmf_cfg80211_update_proto_addr_mode: ADDR_INDIRECT
[  825.530191] IPv6: ADDRCONF(NETDEV_UP): wlp1s0: link is not ready
root@srvito-laptop:/home/srvito#

**Comment by lucasgsantos** [comment]
> Instead of creating a monitor interface you might want to try to just enable monitor mode within the firmware (`nexutil -Iwlp1s0 -m2`) and use [`libfakeioctl`](https://github.com/seemoo-lab/nexmon/tree/master/utilities/libfakeioctl) to make it appear as monitor interface to the tool that you want to use.

Hi, I also tried to put the interface in monitor mode manually and got the output below. It seems it is not possible to monitor directly using the main wireless interface (wlp1s0) for some reason airodump thinks it is ethernet and not wireless. 

root@srvito-laptop:/home/srvito/nexmon/utilities/libfakeioctl# systemctl stop NetworkManager 2>/dev/null || true systemctl stop wpa_supplicant 2>/dev/null || true pkill wpa_supplicant 2>/dev/null || true
root@srvito-laptop:/home/srvito/nexmon/utilities/libfakeioctl# iwconfig
usb0      no wireless extensions.

l4tbr0    no wireless extensions.

wlp1s0    IEEE 802.11  ESSID:off/any
          Mode:Managed  Access Point: Not-Associated
          Retry short limit:7   RTS thr:off   Fragment thr:off
          Encryption key:off
          Power Management:on

bond0     no wireless extensions.

usb1      no wireless extensions.

dummy0    no wireless extensions.

enxe466e56d0229  no wireless extensions.

sit0      no wireless extensions.

tunl0     no wireless extensions.

lo        no wireless extensions.

root@srvito-laptop:/home/srvito/nexmon/utilities/libfakeioctl# nexutil -Iwlp1s0 -m2
root@srvito-laptop:/home/srvito/nexmon/utilities/libfakeioctl# sudo ip link set wlp1s0 down
root@srvito-laptop:/home/srvito/nexmon/utilities/libfakeioctl# sudo iw dev wlp1s0 set type monitor
root@srvito-laptop:/home/srvito/nexmon/utilities/libfakeioctl# sudo ip link set wlp1s0 up
root@srvito-laptop:/home/srvito/nexmon/utilities/libfakeioctl# iwconfig
usb0      no wireless extensions.

l4tbr0    no wireless extensions.

wlp1s0    IEEE 802.11  Mode:Monitor  Frequency:2.412 GHz  Tx-Power=31 dBm
          Retry short limit:7   RTS thr:off   Fragment thr:off
          Power Management:on

bond0     no wireless extensions.

usb1      no wireless extensions.

dummy0    no wireless extensions.

enxe466e56d0229  no wireless extensions.

sit0      no wireless extensions.

tunl0     no wireless extensions.

lo        no wireless extensions.

root@srvito-laptop:/home/srvito/nexmon/utilities/libfakeioctl# LD_PRELOAD=libfakeioctl.so tcpdump -i wlp1s0
tcpdump: verbose output suppressed, use -v[v]... for full protocol decode
listening on wlp1s0, link-type EN10MB (Ethernet), snapshot length 262144 bytes
^C
0 packets captured
0 packets received by filter
0 packets dropped by kernel

root@srvito-laptop:/home/srvito/nexmon/utilities/libfakeioctl#  LD_PRELOAD=libfakeioctl.so airodump-ng wlp1s0

ARP linktype is set to 1 (Ethernet) - expected ARPHRD_IEEE80211,
ARPHRD_IEEE80211_FULL or ARPHRD_IEEE80211_PRISM instead.  Make
sure RFMON is enabled: run 'airmon-ng start wlp1s0 <#>'
Sysfs injection support was not found either.

Failed initializing wireless card(s): wlp1s0
root@srvito-laptop:/home/srvito/nexmon/utilities/libfakeioctl#

root@srvito-laptop:/home/srvito/nexmon/utilities/libfakeioctl#

root@srvito-laptop:/home/srvito# dmesg | grep -Ei 'brcm|firmware|nexmon|wlp1s0|mon0|ERR:' | tail -n 200
[    0.000000] psci: PSCIv1.1 detected in firmware.
[    0.000000] Kernel command line: root=/dev/mmcblk0p2 rootfstype=ext4 rw   firmware_class.path=/lib/firmware/ access=m2   rootlabel=SWR-NOB rootlabel_retries=1   boot_m=1 boot_p=1 swr_dir=/switchroot/ubuntu-noble/   pmc_r2p.enabled=1 pmc_r2p.action=self   pmc_r2p.param1=1 pmc_r2p.param2=1   fbcon=map:9 consoleblank=0   nvdec_enabled=0 tegra_fbmem=0x400000@0xf5a00000 systemd.unified_cgroup_hierarchy=0 systemd.legacy_systemd_cgroup_controller=1 splash
[    0.141260] mc-err: mcerr ops are set to t21x
[    1.170970] THERMAL TSKIN EST: end of probe, return err: 0
[    1.181373] tegra-xusb 70090000.xusb: Firmware timestamp: 2019-10-17 15:58:59 UTC, Version: 50.25 release
[    1.806856] tegra210-cpufreq cpufreq: probe()...err:-517
[   10.721878] brcmfmac: loading out-of-tree module taints kernel.
[   10.726231] brcmfmac 0000:01:00.0: enabling device (0000 -> 0002)
[   13.664397] brcmfmac: brcmf_msgbuf_query_dcmd: Timeout on response for query command
[   13.664455] brcmfmac: brcmf_c_get_clm_name: retrieving revision info failed (-5)
[   13.664474] brcmfmac: brcmf_c_process_clm_blob: get CLM blob file name failed (-5)
[   13.664492] brcmfmac: brcmf_c_preinit_dcmds: download CLM blob file failed, -5
[   13.664509] brcmfmac: brcmf_bus_start: failed: -5
[   13.664544] brcmfmac: brcmf_pcie_attach_bus: dongle is not responding
[  829.487809] brcmfmac: Firmware version = wl0: Feb  3 2017 18:37:23 version 7.35.101.5 (r682980) FWID 01-1d899931
[  829.489444] brcmfmac: brcmf_c_preinit_dcmds: CLM version = API: 12.1 Data: 7.10.16 Compiler: 1.21.1 ClmImport: 1.21.1 Creation: 2014-02-13 17:00:38 Inc Data: 9.2.6 Inc Compiler: 1.26.12 Inc ClmImport: 1.29.19 Creation: 2017-02-03 18:34:53
[  829.502832] brcmfmac: brcmf_cfg80211_attach: brcmf_cfg80211_attach: enter
[  829.503487] brcmfmac: brcmf_setup_ifmodes: brcmf_setup_ifmodes: p2p=1, mbss=0
[  829.570805] brcmfmac 0000:01:00.0 wlp1s0: renamed from wlan0
[  829.598963] IPv6: ADDRCONF(NETDEV_UP): wlp1s0: link is not ready
[  829.636488] brcmfmac: brcmf_cfg80211_change_iface: brcmf_cfg80211_change_iface, iftype: 2
[  829.636670] brcmfmac: brcmf_cfg80211_update_proto_addr_mode: brcmf_cfg80211_update_proto_addr_mode: ADDR_INDIRECT
[  829.637508] brcmfmac: power management disabled
[  829.680518] brcmfmac: brcmf_cfg80211_add_iface: brcmf_cfg80211_add_iface enter: p2p-dev-wlp1s0 type 10
[  829.680534] brcmfmac: brcmf_vif_add_validate: brcmf_vif_add_validate, NUM_NL80211_IFTYPES: (13)
[  829.680542] brcmfmac: brcmf_vif_add_validate: brcmf_vif_add_validate, pos->wdev.iftype: (2)
[  829.680549] brcmfmac: brcmf_vif_add_validate: brcmf_vif_add_validate, cfg80211_check_combinations for iftype_num: (0)        val:(0)
[  829.680556] brcmfmac: brcmf_vif_add_validate: brcmf_vif_add_validate, cfg80211_check_combinations for iftype_num: (1)        val:(0)
[  829.749823] IPv6: ADDRCONF(NETDEV_UP): wlp1s0: link is not ready
[  835.260458] brcmfmac: brcmf_cfg80211_reg_notifier: not a ISO3166 code (0x42 0x52)
[  835.287697] IPv6: ADDRCONF(NETDEV_CHANGE): wlp1s0: link becomes ready
[  919.953494] brcmfmac: brcmf_p2p_send_action_frame: Unknown Frame: category 0xa, action 0x8
[  932.641913] brcmfmac: brcmf_cfg80211_reg_notifier: not a ISO3166 code (0x42 0x52)
[ 1232.155373] brcmfmac: brcmf_run_escan: error (-25)
[ 1232.155504] brcmfmac: brcmf_cfg80211_scan: scan error (-25)
[ 1239.021847] brcmfmac: brcmf_cfg80211_reg_notifier: not a ISO3166 code (0x42 0x52)
[ 1539.071879] brcmfmac: brcmf_run_escan: error (-25)
[ 1539.071929] brcmfmac: brcmf_cfg80211_scan: scan error (-25)
[ 1559.028189] IPv6: ADDRCONF(NETDEV_UP): wlp1s0: link is not ready
[ 1588.170615] brcmfmac: brcmf_cfg80211_reg_notifier: not a ISO3166 code (0x42 0x52)
[ 1588.188927] IPv6: ADDRCONF(NETDEV_CHANGE): wlp1s0: link becomes ready
[ 3382.004354] IPv6: ADDRCONF(NETDEV_UP): wlp1s0: link is not ready
[ 3382.565259] brcmfmac: brcmf_cfg80211_escan_handler: scan not ready, bsscfgidx=0
[ 3382.565277] brcmfmac: brcmf_fweh_event_worker: event handler failed (69)
[ 3386.321321] tegra-xusb 70090000.xusb: Firmware timestamp: 2019-10-17 15:58:59 UTC, Version: 50.25 release
[ 3386.427944] tegra-xusb 70090000.xusb: Firmware timestamp: 2019-10-17 15:58:59 UTC, Version: 50.25 release
[ 3386.588711] brcmfmac: brcmf_fil_cmd_data: bus is down. we have nothing to do.
[ 3386.588723] brcmfmac: brcmf_fil_cmd_data: bus is down. we have nothing to do.
[ 3386.588819] brcmfmac: brcmf_fil_cmd_data: bus is down. we have nothing to do.
[ 3386.588822] brcmfmac: brcmf_cfg80211_get_channel: chanspec failed (-5)
[ 3386.595462] brcmfmac: brcmf_free_wiphy: brcmf_free_wiphy: enter
[ 3389.495219] brcmfmac: brcmf_msgbuf_query_dcmd: Timeout on response for query command
[ 3389.495268] brcmfmac: brcmf_c_get_clm_name: retrieving revision info failed (-5)
[ 3389.495300] brcmfmac: brcmf_c_process_clm_blob: get CLM blob file name failed (-5)
[ 3389.495328] brcmfmac: brcmf_c_preinit_dcmds: download CLM blob file failed, -5
[ 3389.495357] brcmfmac: brcmf_bus_start: failed: -5
[ 3389.495400] brcmfmac: brcmf_pcie_attach_bus: dongle is not responding
[ 5290.198346] tegra-xusb 70090000.xusb: Firmware timestamp: 2019-10-17 15:58:59 UTC, Version: 50.25 release
[ 5440.581058] brcmfmac: Firmware version = wl0: Feb  3 2017 18:37:23 version 7.35.101.5 (r682980) FWID 01-1d899931
[ 5440.581278] brcmfmac: brcmf_c_preinit_dcmds: CLM version = API: 12.1 Data: 7.10.16 Compiler: 1.21.1 ClmImport: 1.21.1 Creation: 2014-02-13 17:00:38 Inc Data: 9.2.6 Inc Compiler: 1.26.12 Inc ClmImport: 1.29.19 Creation: 2017-02-03 18:34:53
[ 5440.584341] brcmfmac: brcmf_cfg80211_attach: brcmf_cfg80211_attach: enter
[ 5440.584557] brcmfmac: brcmf_setup_ifmodes: brcmf_setup_ifmodes: p2p=1, mbss=0
[ 5440.610154] brcmfmac 0000:01:00.0 wlp1s0: renamed from wlan0
[ 5440.646102] IPv6: ADDRCONF(NETDEV_UP): wlp1s0: link is not ready
[ 5440.684946] brcmfmac: brcmf_cfg80211_change_iface: brcmf_cfg80211_change_iface, iftype: 2
[ 5440.685071] brcmfmac: brcmf_cfg80211_update_proto_addr_mode: brcmf_cfg80211_update_proto_addr_mode: ADDR_INDIRECT
[ 5440.685746] brcmfmac: power management disabled
[ 5440.724031] brcmfmac: brcmf_cfg80211_add_iface: brcmf_cfg80211_add_iface enter: p2p-dev-wlp1s0 type 10
[ 5440.724067] brcmfmac: brcmf_vif_add_validate: brcmf_vif_add_validate, NUM_NL80211_IFTYPES: (13)
[ 5440.724074] brcmfmac: brcmf_vif_add_validate: brcmf_vif_add_validate, pos->wdev.iftype: (2)
[ 5440.724081] brcmfmac: brcmf_vif_add_validate: brcmf_vif_add_validate, cfg80211_check_combinations for iftype_num: (0)        val:(0)
[ 5440.724087] brcmfmac: brcmf_vif_add_validate: brcmf_vif_add_validate, cfg80211_check_combinations for iftype_num: (1)        val:(0)
[ 5440.791309] IPv6: ADDRCONF(NETDEV_UP): wlp1s0: link is not ready
[ 5443.596534] IPv6: ADDRCONF(NETDEV_CHANGE): wlp1s0: link becomes ready
[ 5470.622937] brcmfmac: brcmf_p2p_send_action_frame: Unknown Frame: category 0xa, action 0x8
[ 5489.517839] brcmfmac: brcmf_cfg80211_reg_notifier: not a ISO3166 code (0x42 0x52)
[ 6096.238778] brcmfmac: brcmf_cfg80211_escan_handler: scan not ready, bsscfgidx=0
[ 6096.238799] brcmfmac: brcmf_fweh_event_worker: event handler failed (69)
[ 6119.869439] brcmfmac: nexmon_nl_ioctl_handler: NEXMON: nexmon_nl_ioctl_handler: Enter
[ 6119.869461] brcmfmac: nexmon_nl_ioctl_handler: NEXMON: nexmon_nl_ioctl_handler: 0058454e 20 36
[ 6119.869471] brcmfmac: nexmon_nl_ioctl_handler: NEXMON: nexmon_nl_ioctl_handler: calling brcmf_fil_cmd_data_set, cmd: 108
[ 6119.904789] brcmfmac: nexmon_nl_ioctl_handler: NEXMON: nexmon_nl_ioctl_handler: Exit
[ 6167.711128] brcmfmac: brcmf_cfg80211_change_iface: brcmf_cfg80211_change_iface, iftype: 6
[ 6167.711258] brcmfmac: brcmf_cfg80211_update_proto_addr_mode: brcmf_cfg80211_update_proto_addr_mode: ADDR_INDIRECT
[ 6177.203725] IPv6: ADDRCONF(NETDEV_UP): wlp1s0: link is not ready
[ 6214.448711] device wlp1s0 entered promiscuous mode
[ 6319.185617] device wlp1s0 left promiscuous mode
root@srvito-laptop:/home/srvito#

**Comment by jlinktu** [comment]
I would try the following:
1. build the nexmon-patched firmware of version 7.35.101.5 (r682980) (aka `FW_VER_7_35_101_5_sta`) for the `bcm4356`
2. install the patched firmware file by placing it under the expected name and directory in the file system (that depends on your OS, probably something similar to `/lib/firmware/brcm/brcmfmac4356-pcie.bin`)
3. make sure the wireless interface is not managed:
    ```
    $ sudo nmcli dev disconnect wlp1s0
    $ sudo nmcli dev set wlp1s0 managed no
    ```
4. reload the driver (eventually you have to append `_wcc` or `_cyw` to `brcmfmac`):
    ```
    $ sudo modprobe -r brcmfmac
    $ sudo modprobe brcmfmac
    ```
5. bringup the interface:
    ```
    $ sudo ifconfig wlp1s0 up
    $ sudo iw dev wlp1s0 set power_save off
    $ nexutil -Iwlp1s0 -s263 -l512 -b -v$(printf "mpc\x00\x00\x00\x00\x00" | openssl enc -base64 | tr -d "\n")
    $ nexutil -Iwlp1s0 -k1
    ```
6. enable monitor mode within the firmware:
    ```
    $ nexutil -Iwlp1s0 -m2
    ```
7. modify `libfakeioctl` to target interface name `wlp1s0` instead of `wlan0` in the following two places:
https://github.com/seemoo-lab/nexmon/blob/549e7db5bbed07d3a9c99a2dd6a8d6bd7d862a51/utilities/libfakeioctl/fakeioctl.c#L79
and
https://github.com/seemoo-lab/nexmon/blob/549e7db5bbed07d3a9c99a2dd6a8d6bd7d862a51/utilities/libfakeioctl/fakeioctl.c#L83
8. re-build `libfakeioctl.so` and try using `airodump-ng`:
    ```
    $ LD_PRELOAD=libfakeioctl.so airodump-ng wlp1s0
    ```

**Comment by lucasgsantos** [comment]
> I would try the following:
> 
> 1. build the nexmon-patched firmware of version 7.35.101.5 (r682980) (aka `FW_VER_7_35_101_5_sta`) for the `bcm4356`
> 2. install the patched firmware file by placing it under the expected name and directory in the file system (that depends on your OS, probably something similar to `/lib/firmware/brcm/brcmfmac4356-pcie.bin`)
> 3. make sure the wireless interface is not managed:
>    ```
>    $ sudo nmcli dev disconnect wlp1s0
>    $ sudo nmcli dev set wlp1s0 managed no
>    ```
> 4. reload the driver (eventually you have to append `_wcc` or `_cyw` to `brcmfmac`):
>    ```
>    $ sudo modprobe -r brcmfmac
>    $ sudo modprobe brcmfmac
>    ```
> 5. bringup the interface:
>    ```
>    $ sudo ifconfig wlp1s0 up
>    $ sudo iw dev wlp1s0 set power_save off
>    $ nexutil -Iwlp1s0 -s263 -l512 -b -v$(printf "mpc\x00\x00\x00\x00\x00" | openssl enc -base64 | tr -d "\n")
>    $ nexutil -Iwlp1s0 -k1
>    ```
> 6. enable monitor mode within the firmware:
>    ```
>    $ nexutil -Iwlp1s0 -m2
>    ```
> 7. modify `libfakeioctl` to target interface name `wlp1s0` instead of `wlan0` in the following two places:
>    https://github.com/seemoo-lab/nexmon/blob/549e7db5bbed07d3a9c99a2dd6a8d6bd7d862a51/utilities/libfakeioctl/fakeioctl.c#L79
>    
>    and
>    https://github.com/seemoo-lab/nexmon/blob/549e7db5bbed07d3a9c99a2dd6a8d6bd7d862a51/utilities/libfakeioctl/fakeioctl.c#L83
> 8. re-build `libfakeioctl.so` and try using `airodump-ng`:
>    ```
>    $ LD_PRELOAD=libfakeioctl.so airodump-ng wlp1s0
>    ```

I did that. Now airodump gives me a strange error but tcpdump works, so this is progress, right?
Thank you

srvito@srvito-laptop:~$ sudo su
[sudo] password for srvito: 
root@srvito-laptop:/home/srvito# nmcli dev disconnect wlp1s0

Device 'wlp1s0' successfully disconnected.
root@srvito-laptop:/home/srvito# 
root@srvito-laptop:/home/srvito# nmcli dev set wlp1s0 managed no
root@srvito-laptop:/home/srvito# modprobe -r brcmfmac
root@srvito-laptop:/home/srvito# modprobe brcmfmac
root@srvito-laptop:/home/srvito# ifconfig wlp1s0 up
root@srvito-laptop:/home/srvito# iw dev wlp1s0 set power_save off
root@srvito-laptop:/home/srvito# nexutil -Iwlp1s0 -s263 -l512 -b -v$(printf "mpc\x00\x00\x00\x00\x00" | openssl enc -base64 | tr -d "\n")
root@srvito-laptop:/home/srvito# nexutil -Iwlp1s0 -k1
root@srvito-laptop:/home/srvito# nexutil -Iwlp1s0 -m2
root@srvito-laptop:/home/srvito# LD_PRELOAD=/usr/lib/libfakeioctl.so airodump-ng wlp1s0
__nex_driver_io: error ret=-1 errno=95
__nex_driver_io: error ret=-1 errno=95
__nex_driver_io: error ret=-1 errno=95
ioctl(SIOCSIWMODE) failed: Operation not supported
__nex_driver_io: error ret=-1 errno=95
ioctl(SIOCSIWMODE) failed: Operation not supported
Error setting monitor mode on wlp1s0
Failed initializing wireless card(s): wlp1s0
root@srvito-laptop:/home/srvito# LD_PRELOAD=/usr/lib/libfakeioctl.so tcpdump -i wlp1s0 -e -n -v
__nex_driver_io: error ret=-1 errno=95
tcpdump: wlp1s0: That device is not up
root@srvito-laptop:/home/srvito# ifconfig wlp1s0 up
root@srvito-laptop:/home/srvito# LD_PRELOAD=/usr/lib/libfakeioctl.so tcpdump -i wlp1s0 -e -n -v
__nex_driver_io: error ret=-1 errno=95
tcpdump: listening on wlp1s0, link-type EN10MB (Ethernet), snapshot length 262144 bytes
16:18:58.385457 e0:e8:e6:7f:c7:dd > 00:90:4c:1a:10:01, ethertype EAPOL (0x888e), length 113: EAPOL key (3) v1, len 95
16:18:58.386189 00:90:4c:1a:10:01 > e0:e8:e6:7f:c7:dd, ethertype EAPOL (0x888e), length 135: EAPOL key (3) v1, len 117
16:18:58.388654 e0:e8:e6:7f:c7:dd > 00:90:4c:1a:10:01, ethertype EAPOL (0x888e), length 193: EAPOL key (3) v1, len 175
16:18:58.389086 00:90:4c:1a:10:01 > e0:e8:e6:7f:c7:dd, ethertype EAPOL (0x888e), length 113: EAPOL key (3) v1, len 95
16:18:58.394300 00:90:4c:1a:10:01 > 33:33:00:00:00:16, ethertype IPv6 (0x86dd), length 130: (hlim 1, next-header Options (0) payload length: 76) :: > ff02::16: HBH (rtalert: 0x0000) (padn) [icmp6 sum ok] ICMP6, multicast listener report v2, 3 group record(s) [gaddr ff02::1:ff00:e6a to_ex, 0 source(s)] [gaddr ff02::1:ff55:a984 to_ex, 0 source(s)] [gaddr ff02::1:ff4c:90ea to_ex, 0 source(s)]
16:18:58.413488 00:90:4c:1a:10:01 > ff:ff:ff:ff:ff:ff, ethertype IPv4 (0x0800), length 339: (tos 0x0, ttl 64, id 0, offset 0, flags [DF], proto UDP (17), length 325)
    0.0.0.0.68 > 255.255.255.255.67: BOOTP/DHCP, Request from 00:90:4c:1a:10:01, length 297, xid 0x1e8cee53, secs 1, Flags [none]
          Client-Ethernet-Address 00:90:4c:1a:10:01
          Vendor-rfc1048 Extensions
            Magic Cookie 0x63825363
            DHCP-Message (53), length 1: Request
            Client-ID (61), length 7: ether 00:90:4c:1a:10:01
            Parameter-Request (55), length 17: 
              Subnet-Mask (1), Time-Zone (2), Domain-Name-Server (6), Hostname (12)
              Domain-Name (15), MTU (26), BR (28), Classless-Static-Route (121)
              Default-Gateway (3), Static-Route (33), YD (40), YS (41)
              NTP (42), Unknown (119), Classless-Static-Route-Microsoft (249), Unknown (252)
              RP (17)
            MSZ (57), length 2: 576
            Requested-IP (50), length 4: 192.168.10.177
            Hostname (12), length 13: "srvito-laptop"
16:18:58.418601 e0:e8:e6:7f:c7:db > 00:90:4c:1a:10:01, ethertype IPv4 (0x0800), length 358: (tos 0x0, ttl 64, id 22617, offset 0, flags [none], proto UDP (17), length 344)
    192.168.10.1.67 > 192.168.10.177.68: BOOTP/DHCP, Reply, length 316, xid 0x1e8cee53, secs 1, Flags [none]
          Your-IP 192.168.10.177
          Server-IP 192.168.10.1
          Client-Ethernet-Address 00:90:4c:1a:10:01
          Vendor-rfc1048 Extensions
            Magic Cookie 0x63825363
            DHCP-Message (53), length 1: ACK
            Server-ID (54), length 4: 192.168.10.1
            Lease-Time (51), length 4: 43200
            RN (58), length 4: 21600
            RB (59), length 4: 37800
            Subnet-Mask (1), length 4: 255.255.255.0
            BR (28), length 4: 192.168.10.255
            Default-Gateway (3), length 4: 192.168.10.1
            Domain-Name (15), length 3: "lan"
            Hostname (12), length 13: "srvito-laptop"
            Domain-Name-Server (6), length 8: 170.83.37.148,170.83.39.14
16:18:58.515279 00:90:4c:1a:10:01 > 33:33:ff:4c:90:ea, ethertype IPv6 (0x86dd), length 78: (hlim 255, next-header ICMPv6 (58) payload length: 24) :: > ff02::1:ff4c:90ea: [icmp6 sum ok] ICMP6, neighbor solicitation, length 24, who has fe80::490b:180e:674c:90ea
16:18:58.548273 00:90:4c:1a:10:01 > 33:33:ff:55:a9:84, ethertype IPv6 (0x86dd), length 78: (hlim 255, next-header ICMPv6 (58) payload length: 24) :: > ff02::1:ff55:a984: [icmp6 sum ok] ICMP6, neighbor solicitation, length 24, who has 2804:3810:3d9:3700:c7b7:346b:f155:a984
16:18:58.635284 00:90:4c:1a:10:01 > 33:33:ff:00:0e:6a, ethertype IPv6 (0x86dd), length 78: (hlim 255, next-header ICMPv6 (58) payload length: 24) :: > ff02::1:ff00:e6a: [icmp6 sum ok] ICMP6, neighbor solicitation, length 24, who has 2804:3810:3d9:3700::e6a
16:18:58.851436 00:90:4c:1a:10:01 > 33:33:00:00:00:16, ethertype IPv6 (0x86dd), length 130: (hlim 1, next-header Options (0) payload length: 76) :: > ff02::16: HBH (rtalert: 0x0000) (padn) [icmp6 sum ok] ICMP6, multicast listener report v2, 3 group record(s) [gaddr ff02::1:ff00:e6a to_ex, 0 source(s)] [gaddr ff02::1:ff55:a984 to_ex, 0 source(s)] [gaddr ff02::1:ff4c:90ea to_ex, 0 source(s)]
16:18:59.032603 e0:e8:e6:7f:c7:db > ff:ff:ff:ff:ff:ff, ethertype ARP (0x0806), length 42: Ethernet (len 6), IPv4 (len 4), Request who-has 192.168.10.140 tell 192.168.10.1, length 28
16:18:59.032710 00:90:4c:1a:10:01 > e0:e8:e6:7f:c7:db, ethertype IPv4 (0x0800), length 66: (tos 0x0, ttl 64, id 42587, offset 0, flags [DF], proto TCP (6), length 52)
    192.168.10.177.50394 > 140.82.112.21.443: Flags [FP.], cksum 0x6fb2 (correct), seq 264013970, ack 1850499617, win 408, options [nop,nop,TS val 425984 ecr 379484082], length 0
16:18:59.032777 00:90:4c:1a:10:01 > e0:e8:e6:7f:c7:db, ethertype IPv4 (0x0800), length 386: (tos 0xc0, ttl 64, id 63457, offset 0, flags [none], proto ICMP (1), length 372)
    192.168.10.177 > 192.168.10.1: ICMP 192.168.10.177 udp port 68 unreachable, length 352
        (tos 0x0, ttl 64, id 22617, offset 0, flags [none], proto UDP (17), length 344)
    192.168.10.1.67 > 192.168.10.177.68: BOOTP/DHCP, Reply, length 316, xid 0x1e8cee53, secs 1, Flags [none]
          Your-IP 192.168.10.177
          Server-IP 192.168.10.1
          Client-Ethernet-Address 00:90:4c:1a:10:01
          Vendor-rfc1048 Extensions
            Magic Cookie 0x63825363
            DHCP-Message (53), length 1: ACK
            Server-ID (54), length 4: 192.168.10.1
            Lease-Time (51), length 4: 43200
            RN (58), length 4: 21600
            RB (59), length 4: 37800
            Subnet-Mask (1), length 4: 255.255.255.0
            BR (28), length 4: 192.168.10.255
            Default-Gateway (3), length 4: 192.168.10.1
            Domain-Name (15), length 3: "lan"
            Hostname (12), length 13: "srvito-laptop"
            Domain-Name-Server (6), length 8: 170.83.37.148,170.83.39.14
16:18:59.159433 e0:e8:e6:7f:c7:db > 00:90:4c:1a:10:01, ethertype IPv4 (0x0800), length 90: (tos 0x0, ttl 48, id 16431, offset 0, flags [DF], proto TCP (6), length 76)
    140.82.112.21.443 > 192.168.10.177.50394: Flags [P.], cksum 0x4dc3 (correct), seq 1:25, ack 1, win 170, options [nop,nop,TS val 379593153 ecr 425984], length 24
16:18:59.159507 00:90:4c:1a:10:01 > e0:e8:e6:7f:c7:db, ethertype IPv4 (0x0800), length 54: (tos 0x0, ttl 64, id 0, offset 0, flags [DF], proto TCP (6), length 40)
    192.168.10.177.50394 > 140.82.112.21.443: Flags [R], cksum 0x893a (correct), seq 264013971, win 0, length 0
16:18:59.159542 e0:e8:e6:7f:c7:db > 00:90:4c:1a:10:01, ethertype IPv4 (0x0800), length 66: (tos 0x0, ttl 48, id 16432, offset 0, flags [DF], proto TCP (6), length 52)
    140.82.112.21.443 > 192.168.10.177.50394: Flags [F.], cksum 0xc67e (correct), seq 25, ack 1, win 170, options [nop,nop,TS val 379593153 ecr 425984], length 0
16:18:59.159559 00:90:4c:1a:10:01 > e0:e8:e6:7f:c7:db, ethertype IPv4 (0x0800), length 54: (tos 0x0, ttl 64, id 0, offset 0, flags [DF], proto TCP (6), length 40)
    192.168.10.177.50394 > 140.82.112.21.443: Flags [R], cksum 0x893a (correct), seq 264013971, win 0, length 0
16:18:59.572050 00:90:4c:1a:10:01 > 33:33:00:00:00:16, ethertype IPv6 (0x86dd), length 130: (hlim 1, next-header Options (0) payload length: 76) fe80::490b:180e:674c:90ea > ff02::16: HBH (rtalert: 0x0000) (padn) [icmp6 sum ok] ICMP6, multicast listener report v2, 3 group record(s) [gaddr ff02::1:ff00:e6a to_ex, 0 source(s)] [gaddr ff02::1:ff55:a984 to_ex, 0 source(s)] [gaddr ff02::1:ff4c:90ea to_ex, 0 source(s)]
16:18:59.579407 00:90:4c:1a:10:01 > 33:33:00:01:00:02, ethertype IPv6 (0x86dd), length 147: (flowlabel 0xb3027, hlim 1, next-header UDP (17) payload length: 93) fe80::490b:180e:674c:90ea.546 > ff02::1:2.547: [udp sum ok] dhcp6 solicit (xid=54c722 (rapid-commit) (IA_NA IAID:267704053 T1:0 T2:0) (Client-FQDN) (option-request DNS-server DNS-search-list SNTP-servers NTP-server opt_82) (client-ID type 4) (elapsed-time 0))
16:18:59.582977 e0:e8:e6:7f:c7:db > 00:90:4c:1a:10:01, ethertype IPv6 (0x86dd), length 183: (hlim 64, next-header UDP (17) payload length: 129) fe80::e2e8:e6ff:fe7f:c7db.547 > fe80::490b:180e:674c:90ea.546: [udp sum ok] dhcp6 advertise (xid=54c722 (server-ID hwaddr type 1 e0e8e67fc7db) (client-ID type 4) (opt_82) (DNS-server 2804:3810:3d9:3700::1) (DNS-search-list lan.) (IA_NA IAID:267704053 T1:21600 T2:34560 (IA_ADDR 2804:3810:3d9:3700::e6a pltime:152676 vltime:239076)))
16:18:59.783737 00:90:4c:1a:10:01 > ff:ff:ff:ff:ff:ff, ethertype ARP (0x0806), length 42: Ethernet (len 6), IPv4 (len 4), Request who-has 192.168.10.177 tell 192.168.10.177, length 28
16:19:00.056548 e0:e8:e6:7f:c7:db > ff:ff:ff:ff:ff:ff, ethertype ARP (0x0806), length 42: Ethernet (len 6), IPv4 (len 4), Request who-has 192.168.10.140 tell 192.168.10.1, length 28
16:19:00.211375 00:90:4c:1a:10:01 > 33:33:00:00:00:16, ethertype IPv6 (0x86dd), length 130: (hlim 1, next-header Options (0) payload length: 76) fe80::490b:180e:674c:90ea > ff02::16: HBH (rtalert: 0x0000) (padn) [icmp6 sum ok] ICMP6, multicast listener report v2, 3 group record(s) [gaddr ff02::1:ff00:e6a to_ex, 0 source(s)] [gaddr ff02::1:ff55:a984 to_ex, 0 source(s)] [gaddr ff02::1:ff4c:90ea to_ex, 0 source(s)]
16:19:00.646607 00:90:4c:1a:10:01 > 33:33:00:01:00:02, ethertype IPv6 (0x86dd), length 183: (flowlabel 0xb3027, hlim 1, next-header UDP (17) payload length: 129) fe80::490b:180e:674c:90ea.546 > ff02::1:2.547: [udp sum ok] dhcp6 request (xid=a8cbd5 (server-ID hwaddr type 1 e0e8e67fc7db) (IA_NA IAID:267704053 T1:0 T2:0 (IA_ADDR 2804:3810:3d9:3700::e6a pltime:0 vltime:0)) (Client-FQDN) (option-request DNS-server DNS-search-list SNTP-servers NTP-server) (client-ID type 4) (elapsed-time 0))
16:19:00.649702 e0:e8:e6:7f:c7:db > 00:90:4c:1a:10:01, ethertype IPv6 (0x86dd), length 183: (hlim 64, next-header UDP (17) payload length: 129) fe80::e2e8:e6ff:fe7f:c7db.547 > fe80::490b:180e:674c:90ea.546: [udp sum ok] dhcp6 reply (xid=a8cbd5 (server-ID hwaddr type 1 e0e8e67fc7db) (client-ID type 4) (opt_82) (DNS-server 2804:3810:3d9:3700::1) (DNS-search-list lan.) (IA_NA IAID:267704053 T1:21600 T2:34560 (IA_ADDR 2804:3810:3d9:3700::e6a pltime:152675 vltime:239075)))
16:19:01.700314 00:90:4c:1a:10:01 > 01:00:5e:00:00:fb, ethertype IPv4 (0x0800), length 82: (tos 0x0, ttl 1, id 15694, offset 0, flags [DF], proto UDP (17), length 68)
    192.168.10.177.5353 > 224.0.0.251.5353: 0 PTR (QM)? _googlecast._tcp.local. (40)
16:19:01.700369 00:90:4c:1a:10:01 > 01:00:5e:00:00:16, ethertype IPv4 (0x0800), length 54: (tos 0xc0, ttl 1, id 0, offset 0, flags [DF], proto IGMP (2), length 40, options (RA))
    192.168.10.177 > 224.0.0.22: igmp v3 report, 1 group record(s) [gaddr 224.0.0.251 to_ex, 0 source(s)]
16:19:01.700934 00:90:4c:1a:10:01 > 01:00:5e:00:00:fb, ethertype IPv4 (0x0800), length 82: (tos 0x0, ttl 1, id 15695, offset 0, flags [DF], proto UDP (17), length 68)
    192.168.10.177.5353 > 224.0.0.251.5353: 0 PTR (QM)? _googlecast._tcp.local. (40)
16:19:01.711005 00:90:4c:1a:10:01 > 01:00:5e:7f:ff:fa, ethertype IPv4 (0x0800), length 210: (tos 0x0, ttl 1, id 50856, offset 0, flags [DF], proto UDP (17), length 196)
    192.168.10.177.42544 > 239.255.255.250.1900: UDP, length 168
16:19:02.019435 00:90:4c:1a:10:01 > 01:00:5e:00:00:16, ethertype IPv4 (0x0800), length 54: (tos 0xc0, ttl 1, id 0, offset 0, flags [DF], proto IGMP (2), length 40, options (RA))
    192.168.10.177 > 224.0.0.22: igmp v3 report, 1 group record(s) [gaddr 224.0.0.251 to_ex, 0 source(s)]
16:19:02.345677 b4:60:77:d6:ef:92 > 00:90:4c:1a:10:01, ethertype IPv4 (0x0800), length 387: (tos 0x0, ttl 64, id 47942, offset 0, flags [DF], proto UDP (17), length 373)
    192.168.10.158.1900 > 192.168.10.177.42544: UDP, length 345
16:19:02.712246 00:90:4c:1a:10:01 > 01:00:5e:7f:ff:fa, ethertype IPv4 (0x0800), length 210: (tos 0x0, ttl 1, id 51019, offset 0, flags [DF], proto UDP (17), length 196)
    192.168.10.177.42544 > 239.255.255.250.1900: UDP, length 168
16:19:02.713760 00:90:4c:1a:10:01 > ff:ff:ff:ff:ff:ff, ethertype ARP (0x0806), length 42: Ethernet (len 6), IPv4 (len 4), Request who-has 192.168.10.158 tell 192.168.10.177, length 28
16:19:02.714018 00:90:4c:1a:10:01 > 33:33:ff:7f:c7:db, ethertype IPv6 (0x86dd), length 86: (hlim 255, next-header ICMPv6 (58) payload length: 32) fe80::490b:180e:674c:90ea > ff02::1:ff7f:c7db: [icmp6 sum ok] ICMP6, neighbor solicitation, length 32, who has fe80::e2e8:e6ff:fe7f:c7db
          source link-address option (1), length 8 (1): 00:90:4c:1a:10:01
16:19:02.715615 b4:60:77:d6:ef:92 > 00:90:4c:1a:10:01, ethertype ARP (0x0806), length 60: Ethernet (len 6), IPv4 (len 4), Reply 192.168.10.158 is-at b4:60:77:d6:ef:92, length 46
16:19:02.715633 00:90:4c:1a:10:01 > b4:60:77:d6:ef:92, ethertype IPv4 (0x0800), length 74: (tos 0x0, ttl 64, id 32549, offset 0, flags [DF], proto TCP (6), length 60)
    192.168.10.177.40714 > 192.168.10.158.8060: Flags [S], cksum 0x6e4f (correct), seq 2445930211, win 29200, options [mss 1460,sackOK,TS val 430534 ecr 0,nop,wscale 7], length 0
16:19:02.716136 e0:e8:e6:7f:c7:db > 00:90:4c:1a:10:01, ethertype IPv6 (0x86dd), length 86: (hlim 255, next-header ICMPv6 (58) payload length: 32) fe80::e2e8:e6ff:fe7f:c7db > fe80::490b:180e:674c:90ea: [icmp6 sum ok] ICMP6, neighbor advertisement, length 32, tgt is fe80::e2e8:e6ff:fe7f:c7db, Flags [router, solicited, override]
          destination link-address option (2), length 8 (1): e0:e8:e6:7f:c7:db
16:19:02.716638 b4:60:77:d6:ef:92 > 00:90:4c:1a:10:01, ethertype IPv4 (0x0800), length 74: (tos 0x0, ttl 64, id 0, offset 0, flags [DF], proto TCP (6), length 60)
    192.168.10.158.8060 > 192.168.10.177.40714: Flags [S.], cksum 0x2b1f (correct), seq 870750404, ack 2445930212, win 43440, options [mss 1460,sackOK,TS val 33897678 ecr 430534,nop,wscale 8], length 0
16:19:02.716705 00:90:4c:1a:10:01 > b4:60:77:d6:ef:92, ethertype IPv4 (0x0800), length 66: (tos 0x0, ttl 64, id 32550, offset 0, flags [DF], proto TCP (6), length 52)
    192.168.10.177.40714 > 192.168.10.158.8060: Flags [.], cksum 0x02b5 (correct), ack 1, win 229, options [nop,nop,TS val 430537 ecr 33897678], length 0
16:19:02.717003 00:90:4c:1a:10:01 > b4:60:77:d6:ef:92, ethertype IPv4 (0x0800), length 293: (tos 0x0, ttl 64, id 32551, offset 0, flags [DF], proto TCP (6), length 279)
    192.168.10.177.40714 > 192.168.10.158.8060: Flags [P.], cksum 0x8739 (correct), seq 1:228, ack 1, win 229, options [nop,nop,TS val 430537 ecr 33897678], length 227
16:19:02.717991 b4:60:77:d6:ef:92 > 00:90:4c:1a:10:01, ethertype IPv4 (0x0800), length 66: (tos 0x0, ttl 64, id 41995, offset 0, flags [DF], proto TCP (6), length 52)
    192.168.10.158.8060 > 192.168.10.177.40714: Flags [.], cksum 0x0209 (correct), ack 228, win 174, options [nop,nop,TS val 33897678 ecr 430537], length 0
16:19:02.720728 b4:60:77:d6:ef:92 > 00:90:4c:1a:10:01, ethertype IPv4 (0x0800), length 265: (tos 0x0, ttl 64, id 41996, offset 0, flags [DF], proto TCP (6), length 251)
    192.168.10.158.8060 > 192.168.10.177.40714: Flags [P.], cksum 0x72fc (correct), seq 1:200, ack 228, win 174, options [nop,nop,TS val 33897678 ecr 430537], length 199
16:19:02.720781 00:90:4c:1a:10:01 > b4:60:77:d6:ef:92, ethertype IPv4 (0x0800), length 66: (tos 0x0, ttl 64, id 32552, offset 0, flags [DF], proto TCP (6), length 52)
    192.168.10.177.40714 > 192.168.10.158.8060: Flags [.], cksum 0x00ff (correct), ack 200, win 237, options [nop,nop,TS val 430541 ecr 33897678], length 0
16:19:02.721782 b4:60:77:d6:ef:92 > 00:90:4c:1a:10:01, ethertype IPv4 (0x0800), length 1377: (tos 0x0, ttl 64, id 41997, offset 0, flags [DF], proto TCP (6), length 1363)
    192.168.10.158.8060 > 192.168.10.177.40714: Flags [P.], cksum 0x9823 (correct), seq 200:1511, ack 228, win 174, options [nop,nop,TS val 33897679 ecr 430541], length 1311
16:19:02.721821 00:90:4c:1a:10:01 > b4:60:77:d6:ef:92, ethertype IPv4 (0x0800), length 66: (tos 0x0, ttl 64, id 32553, offset 0, flags [DF], proto TCP (6), length 52)
    192.168.10.177.40714 > 192.168.10.158.8060: Flags [.], cksum 0xfbc9 (correct), ack 1511, win 257, options [nop,nop,TS val 430542 ecr 33897679], length 0
16:19:03.209360 b4:60:77:d6:ef:92 > 00:90:4c:1a:10:01, ethertype IPv4 (0x0800), length 387: (tos 0x0, ttl 64, id 48015, offset 0, flags [DF], proto UDP (17), length 373)
    192.168.10.158.1900 > 192.168.10.177.42544: UDP, length 345
16:19:03.713055 00:90:4c:1a:10:01 > 01:00:5e:7f:ff:fa, ethertype IPv4 (0x0800), length 210: (tos 0x0, ttl 1, id 51506, offset 0, flags [DF], proto UDP (17), length 196)
    192.168.10.177.42544 > 239.255.255.250.1900: UDP, length 168
16:19:03.947793 e0:e8:e6:7f:c7:db > ff:ff:ff:ff:ff:ff, ethertype ARP (0x0806), length 42: Ethernet (len 6), IPv4 (len 4), Request who-has 192.168.10.140 tell 192.168.10.1, length 28
16:19:04.307311 00:90:4c:1a:10:01 > e0:e8:e6:7f:c7:db, ethertype ARP (0x0806), length 42: Ethernet (len 6), IPv4 (len 4), Request who-has 192.168.10.1 tell 192.168.10.177, length 28
16:19:04.308771 e0:e8:e6:7f:c7:db > 00:90:4c:1a:10:01, ethertype ARP (0x0806), length 42: Ethernet (len 6), IPv4 (len 4), Reply 192.168.10.1 is-at e0:e8:e6:7f:c7:db, length 28
16:19:04.472187 b4:60:77:d6:ef:92 > 00:90:4c:1a:10:01, ethertype IPv4 (0x0800), length 387: (tos 0x0, ttl 64, id 48071, offset 0, flags [DF], proto UDP (17), length 373)
    192.168.10.158.1900 > 192.168.10.177.42544: UDP, length 345
^C
52 packets captured
54 packets received by filter
0 packets dropped by kernel
root@srvito-laptop:/home/srvito# dmesg | grep -Ei 'brcm|firmware|nexmon|wlp1s0|mon0|ERR:' | tail -n 200
[    0.000000] psci: PSCIv1.1 detected in firmware.
[    0.000000] Kernel command line: root=/dev/mmcblk0p2 rootfstype=ext4 rw   firmware_class.path=/lib/firmware/ access=m2   rootlabel=SWR-NOB rootlabel_retries=1   boot_m=1 boot_p=1 swr_dir=/switchroot/ubuntu-noble/   pmc_r2p.enabled=1 pmc_r2p.action=self   pmc_r2p.param1=1 pmc_r2p.param2=1   fbcon=map:9 consoleblank=0   nvdec_enabled=0 tegra_fbmem=0x400000@0xf5a00000 systemd.unified_cgroup_hierarchy=0 systemd.legacy_systemd_cgroup_controller=1 splash 
[    0.140215] mc-err: mcerr ops are set to t21x
[    1.173763] THERMAL TSKIN EST: end of probe, return err: 0
[    1.183351] tegra-xusb 70090000.xusb: Firmware timestamp: 2019-10-17 15:58:59 UTC, Version: 50.25 release
[    1.835669] tegra210-cpufreq cpufreq: probe()...err:-517
[   10.410574] brcmfmac: loading out-of-tree module taints kernel.
[   10.416295] brcmfmac 0000:01:00.0: enabling device (0000 -> 0002)
[   11.565976] brcmfmac: Firmware version = wl0: Feb  3 2017 18:37:23 version 7.35.101.5 (r682980) FWID 01-1d899931
[   11.566265] brcmfmac: brcmf_c_preinit_dcmds: CLM version = API: 12.1 Data: 7.10.16 Compiler: 1.21.1 ClmImport: 1.21.1 Creation: 2014-02-13 17:00:38 Inc Data: 9.2.6 Inc Compiler: 1.26.12 Inc ClmImport: 1.29.19 Creation: 2017-02-03 18:34:53 
[   11.569072] brcmfmac: brcmf_cfg80211_attach: brcmf_cfg80211_attach: enter
[   11.569289] brcmfmac: brcmf_setup_ifmodes: brcmf_setup_ifmodes: p2p=1, mbss=0
[   11.606217] brcmfmac 0000:01:00.0 wlp1s0: renamed from wlan0
[   14.443398] IPv6: ADDRCONF(NETDEV_UP): wlp1s0: link is not ready
[   14.480536] brcmfmac: brcmf_cfg80211_change_iface: brcmf_cfg80211_change_iface, iftype: 2
[   14.480709] brcmfmac: brcmf_cfg80211_update_proto_addr_mode: brcmf_cfg80211_update_proto_addr_mode: ADDR_INDIRECT
[   14.481394] brcmfmac: power management disabled
[   14.613759] brcmfmac: brcmf_cfg80211_add_iface: brcmf_cfg80211_add_iface enter: p2p-dev-wlp1s0 type 10
[   14.613781] brcmfmac: brcmf_vif_add_validate: brcmf_vif_add_validate, NUM_NL80211_IFTYPES: (13)
[   14.613795] brcmfmac: brcmf_vif_add_validate: brcmf_vif_add_validate, pos->wdev.iftype: (2)
[   14.613808] brcmfmac: brcmf_vif_add_validate: brcmf_vif_add_validate, cfg80211_check_combinations for iftype_num: (0)        val:(0)
[   14.613821] brcmfmac: brcmf_vif_add_validate: brcmf_vif_add_validate, cfg80211_check_combinations for iftype_num: (1)        val:(0)
[   14.685766] IPv6: ADDRCONF(NETDEV_UP): wlp1s0: link is not ready
[   17.155517] IPv6: ADDRCONF(NETDEV_UP): wlp1s0: link is not ready
[   17.172005] IPv6: ADDRCONF(NETDEV_UP): wlp1s0: link is not ready
[   28.170407] IPv6: ADDRCONF(NETDEV_CHANGE): wlp1s0: link becomes ready
[  384.331904] IPv6: ADDRCONF(NETDEV_UP): wlp1s0: link is not ready
[  441.383413] brcmfmac: brcmf_fil_cmd_data: bus is down. we have nothing to do.
[  441.383655] brcmfmac: brcmf_fil_cmd_data: bus is down. we have nothing to do.
[  441.394693] brcmfmac: brcmf_fil_cmd_data: bus is down. we have nothing to do.
[  441.394712] brcmfmac: brcmf_cfg80211_get_channel: chanspec failed (-5)
[  441.434365] brcmfmac: brcmf_free_wiphy: brcmf_free_wiphy: enter
[  457.711974] brcmfmac: Firmware version = wl0: Feb  3 2017 18:37:23 version 7.35.101.5 (r682980) FWID 01-1d899931
[  457.712193] brcmfmac: brcmf_c_preinit_dcmds: CLM version = API: 12.1 Data: 7.10.16 Compiler: 1.21.1 ClmImport: 1.21.1 Creation: 2014-02-13 17:00:38 Inc Data: 9.2.6 Inc Compiler: 1.26.12 Inc ClmImport: 1.29.19 Creation: 2017-02-03 18:34:53 
[  457.715021] brcmfmac: brcmf_cfg80211_attach: brcmf_cfg80211_attach: enter
[  457.715152] brcmfmac: brcmf_setup_ifmodes: brcmf_setup_ifmodes: p2p=1, mbss=0
[  457.756031] brcmfmac 0000:01:00.0 wlp1s0: renamed from wlan0
[  457.796851] IPv6: ADDRCONF(NETDEV_UP): wlp1s0: link is not ready
[  457.834306] brcmfmac: brcmf_cfg80211_change_iface: brcmf_cfg80211_change_iface, iftype: 2
[  457.834459] brcmfmac: brcmf_cfg80211_update_proto_addr_mode: brcmf_cfg80211_update_proto_addr_mode: ADDR_INDIRECT
[  457.835165] brcmfmac: power management disabled
[  457.881668] brcmfmac: brcmf_cfg80211_add_iface: brcmf_cfg80211_add_iface enter: p2p-dev-wlp1s0 type 10
[  457.881684] brcmfmac: brcmf_vif_add_validate: brcmf_vif_add_validate, NUM_NL80211_IFTYPES: (13)
[  457.881692] brcmfmac: brcmf_vif_add_validate: brcmf_vif_add_validate, pos->wdev.iftype: (2)
[  457.881700] brcmfmac: brcmf_vif_add_validate: brcmf_vif_add_validate, cfg80211_check_combinations for iftype_num: (0)        val:(0)
[  457.881707] brcmfmac: brcmf_vif_add_validate: brcmf_vif_add_validate, cfg80211_check_combinations for iftype_num: (1)        val:(0)
[  457.946708] IPv6: ADDRCONF(NETDEV_UP): wlp1s0: link is not ready
[  460.679061] IPv6: ADDRCONF(NETDEV_CHANGE): wlp1s0: link becomes ready
[  486.919774] brcmfmac: power management disabled
[  503.214528] brcmfmac: nexmon_nl_ioctl_handler: NEXMON: nexmon_nl_ioctl_handler: Enter
[  503.214562] brcmfmac: nexmon_nl_ioctl_handler: NEXMON: nexmon_nl_ioctl_handler: 0058454e 528 544
[  503.214577] brcmfmac: nexmon_nl_ioctl_handler: NEXMON: nexmon_nl_ioctl_handler: calling brcmf_fil_cmd_data_set, cmd: 263
[  503.214747] brcmfmac: nexmon_nl_ioctl_handler: NEXMON: nexmon_nl_ioctl_handler: Exit
[  519.324517] brcmfmac: nexmon_nl_ioctl_handler: NEXMON: nexmon_nl_ioctl_handler: Enter
[  519.324534] brcmfmac: nexmon_nl_ioctl_handler: NEXMON: nexmon_nl_ioctl_handler: 0058454e 32 48
[  519.324543] brcmfmac: nexmon_nl_ioctl_handler: NEXMON: nexmon_nl_ioctl_handler: calling brcmf_fil_cmd_data_set, cmd: 263
[  519.324767] brcmfmac: nexmon_nl_ioctl_handler: NEXMON: nexmon_nl_ioctl_handler: Exit
[  539.032085] brcmfmac: nexmon_nl_ioctl_handler: NEXMON: nexmon_nl_ioctl_handler: Enter
[  539.032102] brcmfmac: nexmon_nl_ioctl_handler: NEXMON: nexmon_nl_ioctl_handler: 0058454e 20 36
[  539.032112] brcmfmac: nexmon_nl_ioctl_handler: NEXMON: nexmon_nl_ioctl_handler: calling brcmf_fil_cmd_data_set, cmd: 108
[  539.032285] brcmfmac: nexmon_nl_ioctl_handler: NEXMON: nexmon_nl_ioctl_handler: Exit
[  633.965150] brcmfmac: brcmf_cfg80211_change_iface: brcmf_cfg80211_change_iface, iftype: 6
[  633.965270] brcmfmac: brcmf_cfg80211_update_proto_addr_mode: brcmf_cfg80211_update_proto_addr_mode: ADDR_INDIRECT
[  715.144388] device wlp1s0 entered promiscuous mode
[  715.150282] device wlp1s0 left promiscuous mode
[  723.569376] IPv6: ADDRCONF(NETDEV_UP): wlp1s0: link is not ready
[  725.792238] device wlp1s0 entered promiscuous mode
[  726.025044] brcmfmac: brcmf_cfg80211_change_iface: brcmf_cfg80211_change_iface, iftype: 2
[  726.025186] brcmfmac: brcmf_cfg80211_update_proto_addr_mode: brcmf_cfg80211_update_proto_addr_mode: ADDR_INDIRECT
[  726.125988] brcmfmac: brcmf_cfg80211_reg_notifier: not a ISO3166 code (0x55 0x53)
[  726.198925] IPv6: ADDRCONF(NETDEV_CHANGE): wlp1s0: link becomes ready
[  732.409020] device wlp1s0 left promiscuous mode
root@srvito-laptop:/home/srvito#

**Comment by jlinktu** [comment]
whatever `airodump-ng` does, it seems to me that the wi-fi firmware crashed due to executing it.
if the wi-fi firmware is crashing, you can start investigating by enabling verbose outputs of `brcmfmac` by adding `debug=0x100006` when inserting it.
also check again if any other programs try to access the interface, make sure that no such program is running.

**Comment by lucasgsantos** [comment]
> whatever `airodump-ng` does, it seems to me that the wi-fi firmware crashed due to executing it. if the wi-fi firmware is crashing, you can start investigating by enabling verbose outputs of `brcmfmac` by adding `debug=0x100006` when inserting it. also check again if any other programs try to access the interface, make sure that no such program is running.

I tried that, same output, it seems loading the driver with option debug=0x100006 is making no difference. Do I need to recompile everything with debug flags on?

**Comment by lucasgsantos** [comment]
> whatever `airodump-ng` does, it seems to me that the wi-fi firmware crashed due to executing it. if the wi-fi firmware is crashing, you can start investigating by enabling verbose outputs of `brcmfmac` by adding `debug=0x100006` when inserting it. also check again if any other programs try to access the interface, make sure that no such program is running.

hi @jlinktu 

does this provides any information?

root@srvito-laptop:/home/srvito# systemctl stop NetworkManager 2>/dev/null || true systemctl stop wpa_supplicant 2>/dev/null || true pkill wpa_supplicant 2>/dev/null || true
root@srvito-laptop:/home/srvito# modprobe -r brcmfmac
root@srvito-laptop:/home/srvito# modprobe brcmfmac debug=0x100006
root@srvito-laptop:/home/srvito# ifconfig wlp1s0 up
root@srvito-laptop:/home/srvito# iw dev wlp1s0 set power_save off
root@srvito-laptop:/home/srvito# nexutil -Iwlp1s0 -s263 -l512 -b -v$(printf "mpc\x00\x00\x00\x00\x00" | openssl enc -base64 | tr -d "\n")
root@srvito-laptop:/home/srvito# nexutil -Iwlp1s0 -k1
root@srvito-laptop:/home/srvito# nexutil -Iwlp1s0 -m2
root@srvito-laptop:/home/srvito# LD_PRELOAD=/usr/lib/libfakeioctl.so airodump-ng wlp1s0
__nex_driver_io: error ret=-1 errno=95
__nex_driver_io: error ret=-1 errno=95
__nex_driver_io: error ret=-1 errno=95
ioctl(SIOCSIWMODE) failed: Operation not supported
__nex_driver_io: error ret=-1 errno=95
ioctl(SIOCSIWMODE) failed: Operation not supported
Error setting monitor mode on wlp1s0
Failed initializing wireless card(s): wlp1s0
root@srvito-laptop:/home/srvito# dmesg | grep -Ei 'brcm|bcm|firmware|nex|wlp1s0|mon0|ERR:' | tail -n 200
[    0.000000] psci: PSCIv1.1 detected in firmware.
[    0.000000] Kernel command line: root=/dev/mmcblk0p2 rootfstype=ext4 rw   firmware_class.path=/lib/firmware/ access=m2   rootlabel=SWR-NOB rootlabel_retries=1   boot_m=1 boot_p=1 swr_dir=/switchroot/ubuntu-noble/   pmc_r2p.enabled=1 pmc_r2p.action=self   pmc_r2p.param1=1 pmc_r2p.param2=1   fbcon=map:9 consoleblank=0   nvdec_enabled=0 tegra_fbmem=0x400000@0xf5a00000 systemd.unified_cgroup_hierarchy=0 systemd.legacy_systemd_cgroup_controller=1 splash
[    0.140256] mc-err: mcerr ops are set to t21x
[    1.170047] THERMAL TSKIN EST: end of probe, return err: 0
[    1.180331] tegra-xusb 70090000.xusb: Firmware timestamp: 2019-10-17 15:58:59 UTC, Version: 50.25 release
[    1.836808] tegra210-cpufreq cpufreq: probe()...err:-517
[    1.980527] inv-icm42607x-spi spi3.0: Core probe failed for 0 (-19), trying next compatible
[   11.172729] brcmfmac: loading out-of-tree module taints kernel.
[   11.179839] brcmfmac 0000:01:00.0: enabling device (0000 -> 0002)
[   11.258664] Bluetooth: hci0: BCM: chip id 122
[   11.259175] Bluetooth: hci0: BCM: features 0x0f
[   11.261091] Bluetooth: hci0: BCM4356A3
[   11.261096] Bluetooth: hci0: BCM4356A3 (001.004.009) build 0000
[   12.037372] brcmfmac: Firmware version = wl0: Feb  3 2017 18:37:23 version 7.35.101.5 (r682980) FWID 01-1d899931
[   12.037627] brcmfmac: brcmf_c_preinit_dcmds: CLM version = API: 12.1 Data: 7.10.16 Compiler: 1.21.1 ClmImport: 1.21.1 Creation: 2014-02-13 17:00:38 Inc Data: 9.2.6 Inc Compiler: 1.26.12 Inc ClmImport: 1.29.19 Creation: 2017-02-03 18:34:53
[   12.040166] brcmfmac: brcmf_cfg80211_attach: brcmf_cfg80211_attach: enter
[   12.040396] brcmfmac: brcmf_setup_ifmodes: brcmf_setup_ifmodes: p2p=1, mbss=0
[   12.077198] brcmfmac 0000:01:00.0 wlp1s0: renamed from wlan0
[   12.361273] Bluetooth: hci0: BCM4356A3 (001.004.009) build 0112
[   15.698812] IPv6: ADDRCONF(NETDEV_UP): wlp1s0: link is not ready
[   15.736499] brcmfmac: brcmf_cfg80211_change_iface: brcmf_cfg80211_change_iface, iftype: 2
[   15.736689] brcmfmac: brcmf_cfg80211_update_proto_addr_mode: brcmf_cfg80211_update_proto_addr_mode: ADDR_INDIRECT
[   15.738206] brcmfmac: power management disabled
[   15.879384] brcmfmac: brcmf_cfg80211_add_iface: brcmf_cfg80211_add_iface enter: p2p-dev-wlp1s0 type 10
[   15.879412] brcmfmac: brcmf_vif_add_validate: brcmf_vif_add_validate, NUM_NL80211_IFTYPES: (13)
[   15.879414] brcmfmac: brcmf_vif_add_validate: brcmf_vif_add_validate, pos->wdev.iftype: (2)
[   15.879416] brcmfmac: brcmf_vif_add_validate: brcmf_vif_add_validate, cfg80211_check_combinations for iftype_num: (0)        val:(0)
[   15.879417] brcmfmac: brcmf_vif_add_validate: brcmf_vif_add_validate, cfg80211_check_combinations for iftype_num: (1)        val:(0)
[   15.950650] IPv6: ADDRCONF(NETDEV_UP): wlp1s0: link is not ready
[   18.380341] brcmfmac: brcmf_cfg80211_reg_notifier: not a ISO3166 code (0x42 0x52)
[   18.427373] IPv6: ADDRCONF(NETDEV_CHANGE): wlp1s0: link becomes ready
[10040.879974] tegra-xusb 70090000.xusb: Firmware timestamp: 2019-10-17 15:58:59 UTC, Version: 50.25 release
[10044.218192] IPv6: ADDRCONF(NETDEV_UP): wlp1s0: link is not ready
[10044.830349] brcmfmac: brcmf_cfg80211_escan_handler: scan not ready, bsscfgidx=0
[10044.830363] brcmfmac: brcmf_fweh_event_worker: event handler failed (69)
[10048.626499] tegra-xusb 70090000.xusb: Firmware timestamp: 2019-10-17 15:58:59 UTC, Version: 50.25 release
[10048.741425] tegra-xusb 70090000.xusb: Firmware timestamp: 2019-10-17 15:58:59 UTC, Version: 50.25 release
[10048.899363] brcmfmac: brcmf_fil_cmd_data: bus is down. we have nothing to do.
[10048.899381] brcmfmac: brcmf_fil_cmd_data: bus is down. we have nothing to do.
[10048.899481] brcmfmac: brcmf_fil_cmd_data: bus is down. we have nothing to do.
[10048.899485] brcmfmac: brcmf_cfg80211_get_channel: chanspec failed (-5)
[10048.910708] brcmfmac: brcmf_free_wiphy: brcmf_free_wiphy: enter
[10049.713433] brcmfmac: Firmware version = wl0: Feb  3 2017 18:37:23 version 7.35.101.5 (r682980) FWID 01-1d899931
[10049.713651] brcmfmac: brcmf_c_preinit_dcmds: CLM version = API: 12.1 Data: 7.10.16 Compiler: 1.21.1 ClmImport: 1.21.1 Creation: 2014-02-13 17:00:38 Inc Data: 9.2.6 Inc Compiler: 1.26.12 Inc ClmImport: 1.29.19 Creation: 2017-02-03 18:34:53
[10049.716049] brcmfmac: brcmf_cfg80211_attach: brcmf_cfg80211_attach: enter
[10049.716193] brcmfmac: brcmf_setup_ifmodes: brcmf_setup_ifmodes: p2p=1, mbss=0
[10049.731762] Bluetooth: hci0: BCM: chip id 122
[10049.732265] Bluetooth: hci0: BCM: features 0x0f
[10049.734943] Bluetooth: hci0: BCM4356A3
[10049.734948] Bluetooth: hci0: BCM4356A3 (001.004.009) build 0000
[10049.752060] brcmfmac 0000:01:00.0 wlp1s0: renamed from wlan0
[10049.819530] IPv6: ADDRCONF(NETDEV_UP): wlp1s0: link is not ready
[10049.856814] brcmfmac: brcmf_cfg80211_change_iface: brcmf_cfg80211_change_iface, iftype: 2
[10049.856926] brcmfmac: brcmf_cfg80211_update_proto_addr_mode: brcmf_cfg80211_update_proto_addr_mode: ADDR_INDIRECT
[10049.857589] brcmfmac: power management disabled
[10049.894729] brcmfmac: brcmf_cfg80211_add_iface: brcmf_cfg80211_add_iface enter: p2p-dev-wlp1s0 type 10
[10049.894732] brcmfmac: brcmf_vif_add_validate: brcmf_vif_add_validate, NUM_NL80211_IFTYPES: (13)
[10049.894734] brcmfmac: brcmf_vif_add_validate: brcmf_vif_add_validate, pos->wdev.iftype: (2)
[10049.894736] brcmfmac: brcmf_vif_add_validate: brcmf_vif_add_validate, cfg80211_check_combinations for iftype_num: (0)        val:(0)
[10049.894738] brcmfmac: brcmf_vif_add_validate: brcmf_vif_add_validate, cfg80211_check_combinations for iftype_num: (1)        val:(0)
[10049.894739] brcmfmac: brcmf_vif_add_validate: brcmf_vif_add_validate, cfg80211_check_combinations for iftype_num: (2)        val:(1)
[10049.894741] brcmfmac: brcmf_vif_add_validate: brcmf_vif_add_validate, cfg80211_check_combinations for iftype_num: (3)        val:(0)
[10049.894742] brcmfmac: brcmf_vif_add_validate: brcmf_vif_add_validate, cfg80211_check_combinations for iftype_num: (4)        val:(0)
[10049.964407] IPv6: ADDRCONF(NETDEV_UP): wlp1s0: link is not ready
[10050.339246] Bluetooth: hci0: BCM4356A3 (001.004.009) build 0112
[10052.595046] IPv6: ADDRCONF(NETDEV_CHANGE): wlp1s0: link becomes ready
[14743.863944] brcmfmac: brcmf_fil_cmd_data: bus is down. we have nothing to do.
[14743.864020] brcmfmac: brcmf_fil_cmd_data: bus is down. we have nothing to do.
[14743.864029] brcmfmac: brcmf_cfg80211_get_channel: chanspec failed (-5)
[14743.894398] brcmfmac: brcmf_free_wiphy: brcmf_free_wiphy: enter
[14764.389103] brcmfmac: Firmware version = wl0: Feb  3 2017 18:37:23 version 7.35.101.5 (r682980) FWID 01-1d899931
[14764.390012] brcmfmac: brcmf_c_preinit_dcmds: CLM version = API: 12.1 Data: 7.10.16 Compiler: 1.21.1 ClmImport: 1.21.1 Creation: 2014-02-13 17:00:38 Inc Data: 9.2.6 Inc Compiler: 1.26.12 Inc ClmImport: 1.29.19 Creation: 2017-02-03 18:34:53
[14764.399463] brcmfmac: brcmf_cfg80211_attach: brcmf_cfg80211_attach: enter
[14764.401204] brcmfmac: brcmf_setup_ifmodes: brcmf_setup_ifmodes: p2p=1, mbss=0
[14764.542829] brcmfmac 0000:01:00.0 wlp1s0: renamed from wlan0
[14812.374304] brcmfmac: brcmf_cfg80211_change_iface: brcmf_cfg80211_change_iface, iftype: 2
[14812.374650] brcmfmac: brcmf_cfg80211_update_proto_addr_mode: brcmf_cfg80211_update_proto_addr_mode: ADDR_INDIRECT
[14812.376113] brcmfmac: power management disabled
[14822.300990] brcmfmac: power management disabled
[14846.694722] brcmfmac: nexmon_nl_ioctl_handler: NEXMON: nexmon_nl_ioctl_handler: Enter
[14846.694738] brcmfmac: nexmon_nl_ioctl_handler: NEXMON: nexmon_nl_ioctl_handler: 0058454e 528 544
[14846.694748] brcmfmac: nexmon_nl_ioctl_handler: NEXMON: nexmon_nl_ioctl_handler: calling brcmf_fil_cmd_data_set, cmd: 263
[14846.729334] brcmfmac: nexmon_nl_ioctl_handler: NEXMON: nexmon_nl_ioctl_handler: Exit
[14862.541072] brcmfmac: nexmon_nl_ioctl_handler: NEXMON: nexmon_nl_ioctl_handler: Enter
[14862.541099] brcmfmac: nexmon_nl_ioctl_handler: NEXMON: nexmon_nl_ioctl_handler: 0058454e 32 48
[14862.541109] brcmfmac: nexmon_nl_ioctl_handler: NEXMON: nexmon_nl_ioctl_handler: calling brcmf_fil_cmd_data_set, cmd: 263
[14862.541586] brcmfmac: nexmon_nl_ioctl_handler: NEXMON: nexmon_nl_ioctl_handler: Exit
[14868.675349] brcmfmac: nexmon_nl_ioctl_handler: NEXMON: nexmon_nl_ioctl_handler: Enter
[14868.675377] brcmfmac: nexmon_nl_ioctl_handler: NEXMON: nexmon_nl_ioctl_handler: 0058454e 20 36
[14868.675388] brcmfmac: nexmon_nl_ioctl_handler: NEXMON: nexmon_nl_ioctl_handler: calling brcmf_fil_cmd_data_set, cmd: 108
[14868.675892] brcmfmac: nexmon_nl_ioctl_handler: NEXMON: nexmon_nl_ioctl_handler: Exit
[14881.543516] brcmfmac: brcmf_cfg80211_change_iface: brcmf_cfg80211_change_iface, iftype: 6
[14881.543633] brcmfmac: brcmf_cfg80211_update_proto_addr_mode: brcmf_cfg80211_update_proto_addr_mode: ADDR_INDIRECT
root@srvito-laptop:/home/srvito#
